Shop Name,Address,Contact,State,City,GST
Manisha Beauty parlour,"QVXP+776, Ashutosh Nagar, Krishna Nagar, Alambagh, Lucknow, Uttar Pradesh 226023, India",918052559260,Uttar Pradesh,Lucknow,
manisha bp,"24/110, Kalyanpuri, Laxman Vihar Colony, Civil Lines South, Muzaffarnagar, Uttar Pradesh 251001, India",919012771577,Uttar Pradesh,Saharanpur,
Manisha innovation,"Office 1, B4, Sonigara Kesar Rd, Dynasty Society, Vishnu Dev Nagar, Wakad, Pimpri-Chinchwad, Maharashtra 411057, India",919371064599,Maharashtra,Pune,
mansha b.p.,"7C44+H28, Fish Market Rd, Kotwali, Itwara, Ibrahimpura, Peer Gate Area, Bhopal, Madhya Pradesh 462001, India",917987698396,Madhya Pradesh,Bhopal,
Mansvini Bp,"Chavan Paradise phase 1, Ambegaon Pathar, Dhankawadi, Pune, Maharashtra 411046, India",919552230330,Maharashtra,Pune,
manu makeover,"QVGG+5J, Sindhunagar, Lucknow, Uttar Pradesh 226023, India",919555213035,Uttar Pradesh,Lucknow,
Manya Parlour,"QR85+WCG, Barnai, Lower Barnai, Jammu, 181205",916005314568,Jammu & Kashmir,Jammu,
marium parlour,"33b, Nehru Rd, Doom Dooma, Assam 786151, India",918811877454,Assam,Dibrugarh,
Master cuts n colours Kukatpally,"Kukatpally, 1, Sangeet Nagar, Kukatpally, Hyderabad, Telangana 500072, India",919603436744,Telangana,Hyderabad,
Master kuts and kolors Chintal,chintal ,919908084961,Telangana,Hyderabad,
Matrix salon,"2, Sector 9, Vrindavan Colony, Lucknow, Uttar Pradesh 226029, India",917860165748,Uttar Pradesh,Lucknow,
Mayo Salon,"79W9+P26, Peerkhana Road, Tapa, Tappa R, Punjab 148108, India",919915985909,Punjab,Bhatinda,
Mayra beauty salon,"215/L, Adityapuri Rd, Skakti Nagar, Dharampur, Hussain Nagar, Gorakhpur, Uttar Pradesh 273006, India",919336042173,Uttar Pradesh,Biolume Ho,
Mayuri beauty parlour,"X7WM+663, Palladam, Tamil Nadu 641664, India",919344911222,Tamil Nadu,Coimbatore,
Mayuri bp,"61639, Madhav Nagar, Keshav Nagar, Saharanpur, Uttar Pradesh 247001, India",919149197995,Uttar Pradesh,Saharanpur,
MB Makeup Studio,"555JA/131C, RDSO Colony, Mehndi Khera, Alambagh, Lucknow, Uttar Pradesh 226011, India",917985735991,Uttar Pradesh,Lucknow,
Mb parlour,"101, 555JA/101, Central Ave, RDSO Colony, Mehndi Khera, Alambagh, Lucknow, Uttar Pradesh 226011, India",917985735991,Uttar Pradesh,Lucknow,
Mckingstown - Adajan Surat,"B-19, Monarch, NR Kalpvrux Garden, Gouravpath Road, Pal Adajan, Surat ",918866839373,Uttar Pradesh,Biolume Ho,
Mckingstown - Althan Surat,"Shop No. 1, Ground Floor, Square one, near Sentosa Height,
Apcha Nagar, Althan, Surat, Gujarat ",919057550031,Uttar Pradesh,Biolume Ho,
Mckingstown - Anna Nagar,"1734, 18th Main Rd, Bharathi Nagar, I Block, Anna Nagar, Chennai, Tamil Nadu",918939900567,Uttar Pradesh,Biolume Ho,
Mckingstown - Ayanavaram,"Old No: 334, New No: 138, Konnur High Road, Venkatesapuram Colony, Ayanavaram, Chennai, Tamil Nadu",917358110227,Uttar Pradesh,Biolume Ho,
Mckingstown - Coimbatore,"Koundampalayam Road, Edayarpalayam, Coimbatore, Tamil Nadu 	7200287930	",917200287930,Uttar Pradesh,Biolume Ho,
Mckingstown - Kilpauk New,"Door No. 188E, Poonamallee High Road, Kilpauk, Chennai ",919363701223,Uttar Pradesh,Biolume Ho,
Mckingstown - Kundrathur,"Door No. 2, Ground Floor, Kundrathur Main Road, Moondram Kattalai, Chennai ",916380235784,Uttar Pradesh,Biolume Ho,
Mckingstown - Perungudi,"No. 4, Panchayat Main Rd, Phase-1, Vijayendra Nagar, Perungudi, Chennai, Tamil Nadu",917299150000,Uttar Pradesh,Biolume Ho,
Mckingstown - Salem,"No. 48/3, Rajaji Road, Peramanur, Salem, Tamil Nadu",917200560396,Uttar Pradesh,Biolume Ho,
Mckingstown - Sholinganallur,"No:104, Sholinganallur, Old Mahabalipuram Road, Chennai, Tamil Nadu ",919600627627,Uttar Pradesh,Biolume Ho,
Mckingstown - Thirumullavoyal,"Plot No. A1, Ground Floor, GV Mansarovar, West Mada Street, Thirumullaivoyal, Chennai, Tamil Nadu ",918122219570,Uttar Pradesh,Biolume Ho,
Mckingstown - Vesu Surat,"GF- 12, Aakash Retail, Opp Square NM Mavani Road, 
Vesu, Magdalla, Surat, Gujarat",919998659393,Uttar Pradesh,Biolume Ho,
Mckingstown HO,"253k, Chendurpuram Main Rd, Swaminatha Nagar, Kattupakkam, Chennai, Tamil Nadu 600056, India",918939000123,Tamil Nadu,Chennai,
me cover salon,"PW2M+84P, Saraikela, Jharkhand 833219, India",917033702990,Jharkhand,Jamshedpur,
meena Arya salon,"12/2A, Sarai Khawaja Village, Sector 37, Faridabad, Haryana 121003, India",919821086084,Haryana,Faridabad,
Meena Beauty Parlour,"1, District Hospital Road, Adarsh Colony, Udhampur, 182101",917006342730,Jammu & Kashmir,Jammu,
meena makeover,"431, Sohna Rd, near Medwin Hospital, Ballabhgarh, Faridabad, Haryana 121004, India",917838783058,Haryana,Faridabad,
meenakshi dutt mbd,"Shop No. 1 & 3, Plot No.2, Near Tanishq, Kanth Rd, Adarsh Colony, Moradabad, Uttar Pradesh 244001, India",918445857152,Uttar Pradesh,Moradabad,
Meenakshi Makeover,"D-85, Shradhapuri Phase 2, Meerut, Uttar Pradesh 250001, India",918439198840,Uttar Pradesh,Meerut,
Meenakshi makey,"Unnamed Road, Tigaon, Haryana 121101, India",918368075757,Haryana,Faridabad,
meenu makeover,"88H8+JX6, near ganga vidya Niketan School, Vishnu Colony, Ballabhgarh, Faridabad, Haryana 121004, India",918076778750,Haryana,Faridabad,
Meenu Makeover studio,"FPG7+CJ9, Dwarika Puri, Muzaffarnagar, Uttar Pradesh 251001, India",916397938783,Uttar Pradesh,Meerut,
Meerut Charms Makeup Studio,"XMV2+C58, Meerut, Uttar Pradesh 250001, India",918433126019,Uttar Pradesh,Meerut,
Meghna beauty parlour,"GWV7+HV5, Chaudwar, Odisha 754025, India",919658318235,Odisha,Cuttack,
mehak beauty parlour,"2, Raj Niwas Marg, Ludlow Castle, Civil Lines, Delhi, 110054, India",919971856035,Delhi,North Delhi,
Mehak beauty Salon,"6XC5+QGX Bharat Nagar Park-1, Bharat Nagar, Bathinda, Punjab 151001, India",919417777712,Punjab,Bhatinda,
mehak makeup studio,"2911/4, Bazar Sangatrashan, Chuna Mandi, Paharganj, New Delhi, Delhi 110055, India",919953777467,Delhi,North Delhi,
Melba Beauty Parlour,"Madanriting, Madanryting, Shillong, Meghalaya 793021, India",918257063085,Meghalaya,Shillong,
melon salon,"Q5J4+42X, Near Adityapur Railway Station, Gwalapara, Adityapur, Jamshedpur, Jharkhand 831013, India",916202804695,Jharkhand,Jamshedpur,
Meraki LBP,"CCRH+JPF, Haridhan Chakraborty Sarani, Post, Milan Pally, Rajpur Sonarpur, Hadia, West Bengal 700150, India",917980182749,West Bengal,Kolkata,
Meraki salon,"VWJH+QF6, Braham Nagar, Madehgunj, Lucknow, Uttar Pradesh 226020, India",919987394565,Uttar Pradesh,Lucknow,
merecle beauty parlour,"20235, near Ramashish Niwas, Mango, Jamshedpur, Jharkhand 831012, India",919631531156,Jharkhand,Jamshedpur,
merecle bp,"GAUTAM MAHESH APARTMENT, River Meet Rd, Near Vijaya's Golden Town, West Layout, Sonari, Jamshedpur, Jharkhand 831011, India",917992383905,Jharkhand,Jamshedpur,
mes merry,"4V82+58V, Sepon-Sunpura Rd, Moran Chah Co. Darkhasta No.98, Sepon, Assam 785675, India",918822157622,Assam,Dibrugarh,
Metro Beauty salon,"HH8V+8QP, Civil Lines Rd, Madhavpuri, Bahraich, Uttar Pradesh 271801, India",919838242641,Uttar Pradesh,Biolume Ho,
metro city 2,"RQHH+F5C, Prince Rd, Bhoode ka choraha, Moradabad, Uttar Pradesh 244001, India",918650010101,Uttar Pradesh,Moradabad,
metro looks unisex salon,"55, Pollachi Main Rd, Near Durais Theatre, Mahalingapuram, Tamil Nadu 642002, India",917854236585,Tamil Nadu,Coimbatore,
Metro Unisex Salon,"0, Banjarawala, Dehradun, Uttarakhand 248001, India",919557529340,Uttarakhand,Dehradun,
Mexa  Kanhangadu,"83CP+FR4, Puthiyavalapu, Kanhangad, Kerala 671531, India",919048698968,Kerala,Cochin,
Mia Bella Family salon,"Ananda Sangha, Shrihari Pally, Haltu, Kolkata, West Bengal 700078, India",919748159122,West Bengal,Kolkata,
Miami beauty parlour,"133 A ponurangam road west, R.S. Puram, Coimbatore, Tamil Nadu 641002, India",919894217575,Tamil Nadu,Coimbatore,
Milan Beauty Parlour,"PVW2+JVW, Rehari Colony, Jammu, 180005",919906340217,Jammu & Kashmir,Jammu,
milans glow,"33Q/11, Taj Nagari, Telipara, Tajganj, Agra, Dhandhupura, Uttar Pradesh 282001, India",918923805343,Uttar Pradesh,Agra,
minakshi bp,"GRW4+W2X, Madhu Bazar Road, Sadar Bazaar, Chaibasa, Jharkhand 833201, India",918877183118,Jharkhand,Jamshedpur,
Minakshi Makeovers,"Wing No.3 Near MDDA Park Premnagar, Tyagi Market, Prem Nagar, Dehradun, Uttarakhand 248007, India",918191958807,Uttarakhand,Dehradun,
miraqule,"Scf 138, Sector 37 Main Rd, Huda Market, Sector 37, Faridabad, Haryana 121003, India",919810107981,Haryana,Faridabad,
Mirror n Mirror Unisex salon,"403, Rail Vihar Colony Phase 3rd, Indira Nagar, Gorakhpur, Bharwalia Buzurg, Uttar Pradesh 273001, India",919565752789,Uttar Pradesh,Biolume Ho,
mirror queen,"FWRJ+H6F, Dr Siba Nath Baruah Path, Dibrugarh, Assam 786005, India",917002887101,Assam,Dibrugarh,
Mirror Salon,"MVWH+P9M, Trikuta Nagar, Jammu, 180020",917006234056,Jammu & Kashmir,Jammu,
MIRRORIST UNISEX SALON,"16, Gautam Marg, near Royal Bakery, Nemi Nagar, Vaishali Nagar, Jaipur, Rajasthan 302021, India",917615948611,Rajasthan,Jaipur,
Mirrorr unisex salon,"U5/56, DLF Phase 3, Sector 24, Gurugram, Haryana 122022, India",919811810328,Haryana,Gurugram,
Mirroz,"61/1B, Basanta Lal Saha Rd, Tara Park, Tollygunge, Kolkata, West Bengal 700053, India",918013486658,West Bengal,Kolkata,
MJ colour Trends,"77, Lane Number 16, Suraj Nagar, Jammu, 180002",919858070086,Jammu & Kashmir,Jammu,
MK FAMILY SALON,sodhpur,919330313005,West Bengal,Kolkata,
MK Makeover,"49, Gali Number 6, Block B, Sector 67, Noida, Uttar Pradesh 201301, India",919810254922,Delhi,Delhi,
Mk Professional,"P9XX+X2Q, Railway Stadium Colony, Gorakhpur, Uttar Pradesh 273001, India",919795204500,Uttar Pradesh,Biolume Ho,
MM Lounge,"shop.no.12, 1st floor, Prateek walk at, opp. Supertech North Eye, Prateek Wisteria, Sector 77, Noida, Uttar Pradesh 201301",918448820129,Delhi,Delhi,
model choice unisex salon,"1, Bathola, Bhataula Village, Sector 82, Faridabad, Haryana 121002, India",919650247475,Haryana,Faridabad,
modern beauty,"18, RR Quarter Ln, Rudrapur, Uttarakhand 263153, India",919917121411,Uttar Pradesh,Moradabad,
Modern Beauty Salon,"22103, Guru Teg Bahadar Nagar, Shaibzada Jujhar Singh Nagar, Bathinda, Punjab 151104, India",917986100308,Punjab,Bhatinda,
Modern Inn,"QR6P+XVF, Patoli, Sector 1, Paloura, Jammu, 181124",917889606880,Jammu & Kashmir,Jammu,
Modern Look,"NJP Station.Near Gopal more.Siliguri, West Bengal 734001, India",919832308639,West Bengal,Kolkata,
Modern Looks unisex salon,"G26X+6H6, Huda, Sector 23, Gurugram, Haryana 122022, India",919640246220,Haryana,Gurugram,
Modern Salon,"65, Sector 12-A, Panchkula, Haryana 134109, India",917888989840,Chandigarh,Chandigarh Tri City,
modern unisex salon,"S-51/45, Galli Number 50, S Block, DLF Phase 3, Sector 24, Gurugram, Sikanderpur Ghosi, Haryana 122010, India",919315994157,Haryana,Gurugram,
modis,"140, Harmu Rd, Basant Vihar, Harmu Housing Colony, Delatoli, Ranchi, Jharkhand 834002, India",919304079533,Jharkhand,Ranchi,
Mohini Beauty Parlour & Training Center,"XP7J+W37, Sector 3, Tejgarhi, Meerut, Uttar Pradesh 250004, India",919760290182,Uttar Pradesh,Meerut,
"Mohini Makeover's By ""Happy""","2/10, Central Market Rd, Sector 3, Shastri Nagar, Meerut, Uttar Pradesh 250004, India",919259170261,Uttar Pradesh,Meerut,
Moie S unisex salon,"1310, 14th Cross Rd, Eshwara Layout, Indiranagar, Bengaluru, Karnataka 560038, India",918971330612,Karnataka,Bengaluru,
Momita's beauty salon,"4QR7+JQG, Bongshar, Gopinath Nagar, Jonaknagar, Kahilipara, Guwahati, Assam 781034, India",916001925396,Assam,Guwahati,
Mona Beauty Zone,"834W+3V8, Raipur Rd, Deep Nagar, Raipur, Dehradun, Uttarakhand 248008, India",919639085644,Uttarakhand,Dehradun,
Mona S Beauty salon,"42, Thambuchetty Rd, Cox Town, Bengaluru, Karnataka 560005, India",919945203117,Karnataka,Bengaluru,
monalisa,"guru nanak girls inter College, 33, RR Quarter Ln, Rudrapur, Uttarakhand 263153, India",918433041306,Uttar Pradesh,Moradabad,
Monalisa  Make Oversalon,"2nd cross, 1st main, shivakumarswamy road, Madanayakahalli, Bengaluru, Karnataka 562162, India",919880522553,Uttar Pradesh,Biolume Ho,
Monalisa Beauty Salon,"NH-1A, Shivnagar (Capri, Shiv Nagar, Ladan, 182101",919419161057,Jammu & Kashmir,Jammu,
MONALISA SALON,"28-A, RSEB Colony, Nemi Nagar, Vaishali Nagar, Jaipur, Rajasthan 302021, India",919309215606,Rajasthan,Jaipur,
monalisha beauty parlour,"34C, 34C, Shyampukur St, Sovabazar, Hati Bagan, Shyam Bazar, Kolkata, West Bengal 700009, India",917003577196,West Bengal,Malda,
Monaliza,"339, Building no. 339, block, Shastri Nagar, Geeta Colony, Delhi, 110031, India",919999486480,Delhi,New Delhi,
Monika Beauty parlour,"QFCW+7PP, Baheri, Uttar Pradesh 243201, India",919719724074,Uttar Pradesh,Bareilly,
monisha makeover,"First Floor, Villa F, 10, Metropolis City, Rudrapur, Kalyanpur, Uttarakhand 263153, India",917017688568,Uttar Pradesh,Moradabad,
monti makeover,"575, Milan Vihar Rd, Majholi, Line Par, Moradabad, Uttar Pradesh 244001, India",919761466784,Uttar Pradesh,Moradabad,
MONTY HAIR CAFE,"65-66/AB, Rameshwar Dham Colony, Dadi Ka Phatak, Murlipura Scheme, Murlipura, Jaipur, Rajasthan 302023, India",919875199283,Rajasthan,Jaipur,
moon make over,bonga,918436354014,West Bengal,Kolkata,
"Moon, Trikarippoor","45VG+9VC, Thrikaripur-Olavara -Payyanur Rd, Thrikaripur, North Thrikkaripur, Kerala 671310, India",919961312758,Kerala,Cochin,
mordarn cuts parlour,"4R7X+7Q9, Sepon-Sunpura Rd, Sepon Bazar, Sepon Chah Bagicha 107/110 Nlr, Sepon, Assam 785673, India",919101780265,Assam,Dibrugarh,
mordarn parlour,"HH95+R34, Doom Dooma, Assam 786151, India",917578962164,Assam,Dibrugarh,
morden beauty salon,"101, 555JA/101, Central Ave, RDSO Colony, Mehndi Khera, Alambagh, Lucknow, Uttar Pradesh 226011, India",916394638540,Uttar Pradesh,Lucknow,
Moriah bp,"Q7W4+488, Opp Mapil Building, TRF Colony, Birsanagar, Jamshedpur, Jharkhand 831017, India",918797607416,Jharkhand,Jamshedpur,
mornaz bp,"MWXG+63W, Jail Rd, Saraikela, Jharkhand 833219, India",917033702998,Jharkhand,Jamshedpur,
moromi parlour,"F222+V5V, Lahowal, Niz Lahoal, Assam 786010, India",919957380879,Assam,Dibrugarh,
moumitaz make over beauty salon,bonga,918637819672,West Bengal,Kolkata,
Mr unisex salon,"221/1 Subash nagar, Old Railway Rd, near Shiv Murti, Pratap Nagar, Sector 8, Gurugram, Haryana 122001, India",919034249025,Haryana,Gurugram,
Mr. Barbar family salon,"GF78+G9F, Pipe Line Rd, IDA Jeedimetla, Jeedimetla, Hyderabad, Telangana 500055, India",918639085810,Telangana,Hyderabad,
MRIGNAYANI B.P.,"85, Noor Mahal Rd, Kali Basti, Peer Gate Area, Bhopal, Madhya Pradesh 462001, India",917415208043,Madhya Pradesh,Bhopal,
mrimony lbp,new barakpur,918420799120,West Bengal,Kolkata,
Mrs.Salon,"9CH7+H46, Nainital Rd, near Adesh Dental Hospital, Shastri Nagar, Izatnagar, Bareilly, Uttar Pradesh 243122, India",918171667777,Uttar Pradesh,Bareilly,
MS unisex salon,"D-3, GT Karnal Rd, Veer Nagar Jain Colony, Vir Nagar Jain Colony, Block D, Rana Pratap Bagh, Ashok Vihar, Delhi, 110007, India",918800204998,Delhi,North Delhi,
mummy,"B210, Purba Diganta, Santoshpur, Kolkata, West Bengal 700075, India",919632587410,West Bengal,Kolkata,
muskan,"22, Shastri Puram Rd, Near Kargil Petrol Pump, Suruchipuram Colony, Lohamandi, Agra, Uttar Pradesh 282007, India",919193440020,Uttar Pradesh,Agra,
Muskan Beauty Parlour,"P9GP+GQH, Rail Vihar Colony Phase 3rd, Taramandal, Bharwalia Buzurg, Gorakhpur, Uttar Pradesh 273010, India",917266070754,Uttar Pradesh,Biolume Ho,
muskan cosmetic,"QVXG+9G2, Indralok Colony, Alambagh, Lucknow, Uttar Pradesh 226023, India",919336361951,Uttar Pradesh,Lucknow,
mv makeover unisex salon,"C5B-30, C5B Block, Janakpuri, Delhi, 110058, India",919818266950,Uttar Pradesh,Noida,
my makeup studio,"Tularam Market, Main Bazaar, 88QG+32X, Rajiv Gandhi Marg, Baniawada, Sector 1, Ballabhgarh, Faridabad, Haryana 121004, India",917835955153,Haryana,Faridabad,
my style,"BOHERA GANESH TEMPLE, Bohra Ganesh Rd, near VISHAL KIRANA STORE, Ganapati Nagar, Udaipur, Rajasthan 313001, India",919928226385,Rajasthan,Udaipur,
my Sushmita,"7-1-53, Chinna Waltair Main Rd, Kirlampudi Layout, Chinna Waltair, Pedda Waltair, Visakhapatnam, Andhra Pradesh 530017, India",918309217422,Uttar Pradesh,Biolume Ho,
N P Looks Salon,"1521, Barnala, Punjab 148101, India",919501061808,Punjab,Bhatinda,
N.K. Beauty Parlour,"Opp.SBI Bank,Shiv Chowk, Kankerkhera Meerut,",917533810633,Uttar Pradesh,Meerut,
n2 saloon,"2GNB Road, Tinsukia College Rd, Chirapatty, Tinsukia, Assam 786125, India",919678870436,Assam,Dibrugarh,
Naaz makeover,"194, Sultanwind Rd, Choura Bazar, Mandir Wala Bazar, Gobind Nagar, Amritsar, Amritsar Cantt., Punjab 143001, India",918837687703,Punjab,Amritsar,
nachural bp,"Q699+WW5, Bajrangi Bagan, Lakshimi Nagar, Burma Mines, Jamshedpur, Bagbera colony, Jharkhand 831007, India",918263020776,Jharkhand,Jamshedpur,
nagma bp,"XGGJ+JQ8, Shobi Ansari Amman Colony, Kamal Colony, Saharanpur, Uttar Pradesh 247001, India",916395434380,Uttar Pradesh,Saharanpur,
nagma makeover,"12/8-b, Gurudwara Rd, Block 12, Tilak Nagar, New Delhi, Delhi, 110018, India",918383013937,Uttar Pradesh,Noida,
nai salo,"68, Road No. 3, Kagal Nagar, Sonari, Jamshedpur, Jharkhand 831011, India",919170043762,Jharkhand,Jamshedpur,
Naina parlour,"4V72+J35, Sepon Bazar, Dibrugarh, Sepon, Assam 785673, India",919101633855,Assam,Dibrugarh,
naksh beauty hub,"49, Sun City Rd, near Apurva Medical, Anand Nagar, Pune, Maharashtra 411051, India",917057077999,Maharashtra,Pune,
naksh beauty hub salon,"FRJG+HM4, Shiv Swami Samarth Math Marg, Vitthalwadi, Hingne Khurd, Pune, Maharashtra 411051, India",919881507126,Maharashtra,Pune,
naksh hub salon g,"36/1/68, Vetal Nagar, Wanrai Colony, Khanapur Village, Pune, Maharashtra 411046, India",919881507123,Maharashtra,Pune,
Nancy beauty parlour,"13, Govindha Raj Nagar Rd, Govindaraj Nagar, Road, Periyar Nagar, Erode, Tamil Nadu 638001, India",919842725413,Tamil Nadu,Coimbatore,
Nanika Makeover,"276, Brahmpuri, Meerut, Uttar Pradesh 250002, India",919690010931,Uttar Pradesh,Meerut,
NATURAL BEAUTY FAMILY SALON,"90, Ramkrishna Rd, Ward 14, Hakim Para, Siliguri, West Bengal 734001, India",918250882466,West Bengal,Siliguri,
NATURAL BEAUTY LADIES PARLOUR,"MCWJ+V5Q, Ward 30, Deshbandhu Para, Siliguri, West Bengal 734004, India",918250882446,West Bengal,Siliguri,
Natural Beauty Parlour,"V2HC+HFX, Kailash Vihar Colony, Hasangarden Colony, Kamta, Lucknow, Uttar Pradesh 226028, India",919838967997,Uttar Pradesh,Lucknow,
natural beauty parlour 2,"115-A, Pushpanjali Rd, Tulsi Bagh, Buri Ka Nagla, DayalBagh, Agra, Uttar Pradesh 282005, India",917300982644,Uttar Pradesh,Agra,
Natural care,"243, Peramanur Main Rd, Salem, Tamil Nadu 636007, India",917708508209,Tamil Nadu,Coimbatore,
Natural Cherupuzha,"79F7+PHM, Cherupuzha, Kerala 670511, India",919495909723,Kerala,Cochin,
natural glow,"B7, Quadri Complex, SBI, Kanta Toli Chowk, Purulia Rd, Dangartoli, Nayatoli, Ranchi, Jharkhand 834001, India",916206945036,Jharkhand,Ranchi,
Natural touch beauty parlour,"LIG-390, Dugri Rd, Duggri, Urban Estate Dugri, Ludhiana, Punjab 141003, India",919216877804,Punjab,Ludhiana,
Natural's hair and Beauty salon,"3G35+P36, Hesarghatta Rd, Defence Colony, Bagalakunte, Bengaluru, Karnataka 560073, India",917975299912,Uttar Pradesh,Biolume Ho,
Naturals,"48J2+V3P, Cheruthazham - Kuttur - Peringome Rd, Mathamangalam, Eramam, Kerala 670306, India",917012490243,Kerala,Cochin,
Natures ladies Beauty salon,"146, 69th Cross Rd, 1st Block, Rajajinagar, Bengaluru, Karnataka 560010, India",919035710447,Karnataka,Bengaluru,
Natures Way,"H8M5+9PG, A Block, Sector 15, Noida, Uttar Pradesh 201301, India",918800355462,Delhi,Delhi,
Navdeep bridal studio,"JQHW+7JX, Karvan Colony, Chheharta, Amritsar, Punjab 143105, India",917814931408,Punjab,Amritsar,
Navikar Makeup studio and clinic,"321, Zarda Bagan, Jyangra, Rajarhat, Kolkata, West Bengal 700059, India",917278891730,West Bengal,Malda,
Navya Makeover & Academy,"252, N B Colony, Bharat Vihar, Modipuram, Meerut, Uttar Pradesh 250002, India",917457802522,Uttar Pradesh,Meerut,
NAWAB SALON,Unknown,919653064603,Uttar Pradesh,Lucknow,
nayra beauty parlour,"E-24, E-24, Meera Marg, Jawahar Nagar, Sri Ganganagar, 1 A, Rajasthan 335001, India",919460922244,Rajasthan,Hanumangarh,
Nazia hair salon,"1590, Salem Ganj, Ludhiana, Amarpura, Punjab 141008, India",918868003156,Punjab,Ludhiana,
ne nachural bp,"R6H2+XGX, Old Purulia Rd, Zakir Nagar, Mango, Jamshedpur, Jharkhand 832110, India",917667242386,Jharkhand,Jamshedpur,
Neera,"33/163/109A, Bagichi, Tajganj, Agra, Uttar Pradesh 282001, India",919412261435,Uttar Pradesh,Agra,
neeraj makeover studio,"PVP2+FW5, Bakshi Nagar, Jammu, 180001",917889654907,Jammu & Kashmir,Jammu,
Neerja makeover,"1/141, Vardan Khand, Sector 1, Gomti Nagar, Lucknow, Makhdoom Pur, Uttar Pradesh 226010, India",916387507977,Uttar Pradesh,Lucknow,
neeta beauty clinic,"S.C.F. 55, near kaushik bakery, behind Axis Bank Branch, Huda Market, Sector 7a, Block E, Sector 7, Faridabad, Haryana 121001, India",919811592364,Haryana,Faridabad,
neha beauty parlour,"C8GC+63P, Link Rd, opposite New Aggarwal Sadan, Bhoor Colony, Old Faridabad, Faridabad, Haryana 121002, India",919643354803,Haryana,Faridabad,
Neha makeover,"13, Jaipur House, Shahganj, Agra, Uttar Pradesh 282010, India",917895553549,Uttar Pradesh,Agra,
Neha Mam,"SS-30, Sector N, Aliganj, Lucknow, Uttar Pradesh 226021, India",918004264326,Uttar Pradesh,Lucknow,
Nehaz Elegant salon,"6XQ6+M8H, Green City Colony, Baba Farid Nagar, Bathinda, Punjab 151001, India",919023693787,Punjab,Bhatinda,
Nethera's Hair makeup & skin,"CPJH+JM3, Chikkaballapur, Karnataka 562101, India",918197012042,Uttar Pradesh,Biolume Ho,
new age salon & spa,"JM7W+QCQ, Navratna Complex, Pulla Bhuwana, Mahaveer Colony Park, Udaipur, Rajasthan 313001, India",917742437826,Rajasthan,Udaipur,
new arora bp,"61639, Madhav Nagar, Keshav Nagar, Saharanpur, Uttar Pradesh 247001, India",918218525610,Uttar Pradesh,Saharanpur,
New Dogra Saloon,"JV99+6F6, Shakti Nagar Chowk, Shakti Nagar, Amritsar, Amritsar Cantt., Punjab 143006, India",919888444576,Punjab,Amritsar,
New Geeta Beauty Salon,"1st floor shivanajali corner, Atharv Park Society, Sector No. 30, Nigdi, Pimpri-Chinchwad, Maharashtra 411033, India",917397854831,Maharashtra,Pune,
New International Unisex Salon,"PRJG+JPJ, Camp Road, opposite India Colony, Vishal Nagar, Talab Tillo, Jammu, 180002",919419136939,Jammu & Kashmir,Jammu,
New Life Style salon,"#201,2'nd Main road '2'nd cross, NGEF Lay out Kasturinagar ",919538235837,Uttar Pradesh,Biolume Ho,
New Look & Style,"68, Mission Pally, Narendrapur, Kolkata, Rajpur Sonarpur, West Bengal 700103, India",919748497425,West Bengal,Kolkata,
new look beauty parlour,"74, Block G, New Industrial Twp 3, New Industrial Township, Faridabad, Haryana 121001, India",919999562204,Haryana,Faridabad,
New look parlour,"K73, Motia Khan, Sadar Bazaar, New Delhi, Delhi 110055, India",919625808963,Delhi,North Delhi,
New Look Unisex Salon,"Bhauwala Road,Sudhowala Chowk, 8WVP+XFH, Chakrata Rd, Sudhowala, Uttarakhand 248007, India",919760209194,Uttarakhand,Dehradun,
New Looks Unisex Crossing Republic,"Tower-1, Panchsheel Wellington, Bulland Heights, Crossings Republik, Ghaziabad, Uttar Pradesh 201009, India",918368197437,Delhi,Delhi,
new new nifty,"88PF+W4P, Rajiv Gandhi Marg, Bohra Enclave East, Bhraman Wara, Sector 1, Ballabhgarh, Faridabad, Haryana 121004, India",919319332532,Haryana,Faridabad,
new radiance parlour,"Sec.3, Hanumangarh, Rajasthan 335513, India",919783999492,Rajasthan,Hanumangarh,
New Scissor Unisex Salon,"8XP5+89R, Thakurpur Rd, Prem Nagar, Dehradun, Uttarakhand 248007, India",918865000496,Uttarakhand,Dehradun,
new shape and style,"KD1, Wazirpur, Wazirpur Village, Ashok Vihar, New Delhi, Delhi, 110052, India",918383818801,Uttar Pradesh,Noida,
New Star,"Sakthi Nagar Lane, Bakshi Nagar, PRMW+Q2X, Gurha More, Shakti Nagar, Bakshi Nagar, Jammu, 180001",917006130539,Jammu & Kashmir,Jammu,
new style men look salon,"Purulia Rd, Iqra Colony, Mango, Jamshedpur, Tamlia, Jharkhand 832110, India",919608428407,Jharkhand,Jamshedpur,
New Stylo Unisex Salon,"SCF-7, opposite tricity plaza, peermuchalla Near sector 20 panchkula, Peer Muchalla, Haryana, Fatehpur, Punjab 140603, India",918284893102,Chandigarh,Chandigarh Tri City,
New thakoor salon,"34-35/2/1, Shri Aurobindo Rd, near Sitaram Super Market, Babudanga, Bandhaghat, Salkia, Howrah, West Bengal 711106, India",919831201324,West Bengal,Howrah,
New Trendz Unisex Salon,"QR33+QWJ, Lower Muthi, Jammu, 180002",919086339197,Jammu & Kashmir,Jammu,
New Tressez Unisex Salon,"144, Sector 11, Panchkula, Haryana 134108, India",919888735222,Chandigarh,Chandigarh Tri City,
new wev bistupur,"1/A, 1 st floor, H.no, 21, Rd Number 3, Contractors Area, Bistupur, Jamshedpur, Jharkhand 831001, India",919386647844,Jharkhand,Jamshedpur,
New Young Looks Beauty Parlour,"INDRAPRASTHA ESTATE COLONY (NEW MARKET, 2PJ6+QJ8, opposite CAEHS COLLEGE, Gangotri Colony, Daurli, Meerut, Uttar Pradesh 250001, India",919897077187,Uttar Pradesh,Meerut,
nice n new salon,akola,919421837460,Maharashtra,Nagpur,
Nidhi Panday makeover,"QR4W+8G2, Old Janipur, Janipur, Jammu, 180007",917006328247,Jammu & Kashmir,Jammu,
nien,"112, Street, East Point Colony, Pedda Waltair, Visakhapatnam, Andhra Pradesh 530017, India",918977020597,Uttar Pradesh,Biolume Ho,
nifty parlour,"225, Bohra Enclave East, Bhraman Wara, Bhikam Colony, Ballabhgarh, Faridabad, Haryana 121004, India",918586882202,Haryana,Faridabad,
Niharika Makeup studio,"83, 83, Bhopa Rd, Dwarika Puri, Muzaffarnagar, Uttar Pradesh 251001, India",918979246800,Uttar Pradesh,Meerut,
nikhar,"P30, Taj Nagari, Telipara, Tajganj, Agra, Dhandhupura, Uttar Pradesh 282001, India",919997758327,Uttar Pradesh,Agra,
nikhar beauty parlour,"3A/26 block A NEAR SANATAN DHARAM MANDIR NEW w INDUSTRIAL trial TOWNSHIP, Block A, New Industrial Twp 3, New Industrial Township, Faridabad, Haryana 121001, India",919899417875,Haryana,Faridabad,
