Shop Name,Address,Contact,State,City,GST
EXQUISITE SALON,"RV39+9JM, Pink Adark Service Ln, Karolan Ka Barh, Jaipur, Rajasthan 302017, India",918890072863,Rajasthan,Jaipur,
F Kludge Salon,"287b, 12th Cross Rd, near canara bank, Remco Bhel Layout, Ideal Homes Twp, Rajarajeshwari Nagar, Bengaluru, Karnataka 560098, India",919964075455,Karnataka,Bengaluru,
F tv Salon Accademy,"11828, 100 Feet Rd, Guru Teg Bahadar Nagar, Model Town, Bathinda, Punjab 151104, India",919871410333,Punjab,Bhatinda,
f&h luxury salon,"89, Sector 13, Dwarka, Delhi, 110075, India",919718504050,Uttar Pradesh,Noida,
face value,"P172, Kadapara, Phool Bagan, Kankurgachi, Kolkata, West Bengal 700054, India",918981676694,West Bengal,Malda,
face value salon,"FR2R+VM5, Vetal Nagar, Ambegaon Budruk, Pune, Maharashtra 411046, India",919822408740,Maharashtra,Pune,
Fair Glow salon,"F9/17, Block F, Krishna Nagar, New Delhi, Delhi, 110051, India",919990490127,Delhi,Delhi,
Fairtone Beauty parlour,"6049, Mata Rani St, Telian Wala Mohalla, Old City, Bathinda, Punjab 151005, India",919988249016,Punjab,Bhatinda,
Fairy Queen Ladies Beauty Parlour & Training Cente,"1, Abu Ln, Sadar Bazaar, Meerut, Uttar Pradesh 250001, India",919897838501,Uttar Pradesh,Meerut,
Faiz beauty salon,"Shop no.3 ,Shri Girraj Ji Complex, 100 Feet Rd, Mangalam Estate, DayalBagh, Agra, Uttar Pradesh 282005, India",918445452036,Uttar Pradesh,Agra,
fajilal,"A wing, Off Veera Desai Rd, Azad Nagar 2, Jeevan Nagar, Azad Nagar, Andheri West, Mumbai, Maharashtra 400102, India",919819821470,Maharashtra,Mumbai,
Fame salon,"Gurdaspur, Gurdaspur, NH-1A, Gurdaspur Road, Gurdaspur, Police Line, Gurdaspur, Shehzada Nangal, Punjab 143521, India",918872810500,Punjab,Amritsar,
famila bp,"N.I. 7 Road, Adityapur, near D.A.V. School, Adityapur 2, Adityapur Colony, Adityapur, Jamshedpur, Jharkhand 831013, India",916299591958,Jharkhand,Jamshedpur,
Famina flaunt studio,"8-2-120/77/4, Venkat Nagar, Banjara Hills, Hyderabad, Telangana 500033, India",918008090355,Telangana,Hyderabad,
Fancy Salon,"Shop No 169, Sector 37 C, Sector 37, Chandigarh, 160036, India",919815617169,Chandigarh,Chandigarh Tri City,
farah bp,"Shivam Colony, Opp. Bhagwati Colony Main Gate, XHP5+7H4, Behat Rd, Hanuman Nagar, Saharanpur, Dara Kottala, Uttar Pradesh 247001, India",919997001121,Uttar Pradesh,Saharanpur,
farah touch and beauty,"910, Tiraha Behram Khan, Khabas Pura, Daryaganj, Delhi, 110002, India",919582777022,Delhi,North Delhi,
Faraz hair unisex salon,"4205, Sant Nagar, Harsh Vihar, Pitampura, Delhi, 110034, India",919971360959,Delhi,North Delhi,
farul unisex salon,"3, Kakrola Rd, Nishat Park, Sector 15 Dwarka, Dwarka, New Delhi, Delhi, 110078, India",919818465653,Uttar Pradesh,Noida,
Fashion hub parlour,"C-9/14, Sector 1, Gomti Nagar, Lucknow, Makhdoom Pur, Uttar Pradesh 226010, India",919044457534,Uttar Pradesh,Lucknow,
Fashion inn beauty parlour,"9382+RMM, Haladiapada, Alando, Odisha 754111, India",917978649615,Odisha,Cuttack,
Fashion salon,"Yarpur, Bsides, Gupta Complex, DVC Rd, New Jakkanpur, Gardanibagh, Patna, Bihar 800001, India",918340632783,Bihar,Patna,
Fashion villa,"SCF 7, First FloorGTB Market, GTB Market, Khanna, Punjab 141401, India",919780441742,Punjab,Ludhiana,
"Femina , Paravoor","Iritty, Iritty, Kerala 670703, India",917907790938,Kerala,Cochin,
Femina beauty parlour,"47, Faizabad Rd, tiwari, Hazratganj, Uattardhona, Uttar Pradesh 226028, India",919795837864,Uttar Pradesh,Lucknow,
Femina Beauty Salon,Badowala,919837601253,Uttarakhand,Dehradun,
Femina Beauty Saloon,"A-435, New Amritsar Colony, Amritsar Cantt., Amritsar, Punjab 143001, India",918198049875,Punjab,Amritsar,
Femina flaunt,"F8J7+5C3, James Long Sarani, Dutta Para, Purba Barisha, Kolkata, West Bengal 700008, India",918336011742,West Bengal,Kolkata,
femina hair & beauty salon,"70, 70, Suratgarh - Hanumangarh Rd, Sector 12, Old Khunja, Housing Board, Hanumangarh, Rajasthan 335512, India",917976296700,Rajasthan,Hanumangarh,
femina salon &spa,"507/3, Mumbai Pune Bypass Rd Flyover, Near Aroh Garden, Ambegaon Pathar, Ambegaon Budruk, Pune, Maharashtra 411046, India",918975819535,Maharashtra,Pune,
Femme By Komal Gil Salon & Academy,"161, Jawahar Nagar, Brahmpuri, Meerut, Uttar Pradesh 250002, India",918077956091,Uttar Pradesh,Meerut,
Feuerangi unisex salon,"urya's Palam Central, H-Block, Opp. Celebrity Towers,, Pocket H, Sector 1, Palam Vihar, Gurugram, Haryana 122017, India",917700097777,Haryana,Gurugram,
figure n belle,"b, 213, Ashok Vihar Phase 1 Rd, Pocket B, Phase 1, Ashok Vihar, Delhi, 110052, India",918076348076,Delhi,Delhi,
final touch,"98FJ+2C9, Tharpakhna, Ranchi, Jharkhand 834001, India",916200438362,Jharkhand,Ranchi,
finaltouch,"F-7/8, Model Town Phase 2, Model Town Phase I, Model Town, Delhi, 110009, India",919027650391,Delhi,Delhi,
FIVE SENSES FAMILY SALON,"Kharagpur City Rd, Inda Below L&T Finance Holdings/Premises No-148, 132, Inda, Kharagpur, Kharagpur Railway Settlement, West Bengal 721301, India",919609083794,West Bengal,Kolkata,
flamingo makeup studio,"SCO 10, 1st floor Sector 27D, Sector 27, Chandigarh, 160019, India",918872466656,Chandigarh,Chandigarh Tri City,
FLAUNT SALON,"4/58, Nagarbhavi Main road Vijayanagar Bangalore ",917996888388,Uttar Pradesh,Biolume Ho,
FLAUNT SALON AND SPA,"2nd cross, 1st main, shivakumarswamy road, Madanayakahalli, Bengaluru, Karnataka 562162, India",919886073040,Uttar Pradesh,Biolume Ho,
flawless Beauty Salon,Marunji Hinjewadi ,919921183275,Maharashtra,Pune,
Flower beauty parlour,"33Q/11, Taj Nagari, Telipara, Tajganj, Agra, Dhandhupura, Uttar Pradesh 282001, India",919897280394,Uttar Pradesh,Agra,
Flying Kenchi Unisex Salon,"Jaipuria Plaza, Jaipuria Plaza, D-Block, Sector 26, Noida, Uttar Pradesh 201301, India",919654845438,Delhi,Delhi,
Forever Glam,"73, Mahuesugharpur, Shakti Nagar Colony, Gorakhpur, Uttar Pradesh 273001, India",917376544708,Uttar Pradesh,Biolume Ho,
Forever salon and academy,"410, New Deep Nagar, Civil Lines, Ludhiana, Punjab 141001, India",919878869134,Punjab,Ludhiana,
freands unisex salon,"206A,Sushant Tower,Sushant Lok-II, Sector-56, Sector 56, Gurugram, Ghata, Haryana 122011, India",919213825777,Haryana,Gurugram,
fresh & fine men salon kashidi,"766, Straight Mile Rd, New Sitaram Dera, Golmuri, Jamshedpur, Jharkhand 831009, India",917003554954,Jharkhand,Jamshedpur,
fresh looks,nagar bazar,917085567002,West Bengal,Kolkata,
friends salon,"43/44, Badgaon Udaipur Link Rd, Shanti Niketan Colony, Mahaveer Colony Park, Udaipur, Rajasthan 313011, India",919549181771,Rajasthan,Udaipur,
FS Luxury Salon,"Building, B Block, Gardenia Glory, Sector 46, Noida, Uttar Pradesh 201303, India",918750003815,Delhi,Delhi,
fs luxury unisex salon,"G9X7+P44, B Block, Gardenia Glory, Sector 46, Noida, Uttar Pradesh 201303, India",918750003815,Uttar Pradesh,Noida,
Fully Beauty Parlour,"Room No.4, Side Shop Synod Complex, Mawkhar, Near Jaiaw Parking, Mawkhar Main Rd, Mawkhar, Shillong, Meghalaya 793002, India",919774936080,Meghalaya,Shillong,
G unisex salon,"197, Kaveri Vihar Phase II, Shamsabad, Agra, Basai, Uttar Pradesh 282001, India",918006740008,Uttar Pradesh,Agra,
G.Frisur salon,"3F77+JVF, Shivkumara Swamiji Rd, Madanayakahalli, Bengaluru, Karnataka 562162, India",919980035501,Uttar Pradesh,Biolume Ho,
G.FRISUR Unisex beauty salon,"#16,NRI LAYOUT AKSHYA NAGAR KELKERA BANGALORE ",919845505946,Uttar Pradesh,Biolume Ho,
G.Squar unisex salon,"3F77+JVF, Shivkumara Swamiji Rd, Madanayakahalli, Bengaluru, Karnataka 562162, India",919110261425,Uttar Pradesh,Biolume Ho,
G3 unisex salon,"2XF7+9G5, Dr Alagappa Chettiar Rd, Tatabad, Coimbatore, Tamil Nadu 641012, India",919025697437,Tamil Nadu,Coimbatore,
Galaxy salon,"A-1, A-1, Lala Hans Raj Mahajan Rd, Block A, East, Krishna Nagar, New Delhi, Delhi, 110032, India",919599201010,Delhi,Delhi,
galaxy the beauty saloon,"Block C2, 22, A Block, Prashant Vihar, Sector 14, Rohini, New Delhi, Delhi, 110085, India",917056740300,Uttar Pradesh,Noida,
Gauri Makeup Studio,"124-B/182 Block-12,Bata Chauraha,(Manohar Kulfi Wali Gali, B Block, Govind Nagar, Kanpur, Uttar Pradesh 208006, India",919795361725,Uttar Pradesh,Lucknow,
Gaytri makeover,"169/11, Pratap Nagar Behind Syndicate Bank, railway road, gurgaon, Pratap Nagar, Sector 8, Gurugram, Haryana 122001, India",918826805848,Haryana,Gurugram,
gazibo salon hair and beauty salon,"House No. 290, A Street No.7, Setia Colony, Sri Ganganagar, 8 Z, Rajasthan 335001, India",917891278912,Rajasthan,Hanumangarh,
GC Makeover,"JV85+W96, Gurbax Nagar, Khazana Wala Gate, Amritsar, Punjab 143001, India",919988084771,Punjab,Amritsar,
Geeta Agencies,paschim vihar Delhi west,919871208073,Uttar Pradesh,Noida,
Geeta beauty pourlar,"1074, Mohalla Sungarhi, Pilibhit, Uttar Pradesh 262001, India",919012827315,Uttar Pradesh,Bareilly,
Geeta makeover,"992V+7VP, Bhim basti, Tigaon, Haryana 121001, India",918287550519,Haryana,Faridabad,
Geetanjali Salon,"Buddha Nagar, Uttar Pradesh 203201, India",919873278381,Delhi,Delhi,
geetanjali studio,"H8MQ+V5H, A-Block, Sector 25, Jal Vayu Vihar, Noida, Uttar Pradesh 201301, India",919004057101,Uttar Pradesh,Noida,
geetha's charms beauty point,"1/10639, mohan park,naveen Shahdara, New Delhi, Delhi, 110032, India",919999095982,Uttar Pradesh,Noida,
geetika beauty parlour,"19, Silver Park, Chander Nagar, Krishna Nagar, Delhi, 110051, India",918287404216,Uttar Pradesh,Biolume Ho,
Geetu Beauty parlour,"6WR9+96W, Sivian Link Road, Hardev Nagar, Guru Nanak Dev Thermal Power Plant Area, Bathinda, Punjab 151002, India",917837226614,Punjab,Bhatinda,
Gem of Derm Salon,"RQ2Q+7XQ, camp, Purkhoo, Jammu, 181123",919018888766,Jammu & Kashmir,Jammu,
gentiemans unisex salon,"6X33+64V, Kargil Petrol Pump, Suruchipuram Colony, Sikandra, Agra, Uttar Pradesh 282007, India",918273247232,Uttar Pradesh,Agra,
get glow,"G1/42, Indira Enclave, Sector 21D, Faridabad, Haryana 121012, India",918750109196,Haryana,Faridabad,
Get Glow Luxury Salon,"2MHM+25W, Sector 7, Shradhapuri Phase 1, Meerut, Uttar Pradesh 250001, India",918958779982,Uttar Pradesh,Meerut,
Girl in beauty salon,"52, Dwarkapuri, Shahdara, New Delhi, Delhi, 110032, India",919958257535,Delhi,New Delhi,
"Gitanjali Make up, Hair salon & Academy","74, Talegaon Varale Rd, Tapodham Colony, Yashwant Nagar, Talegaon Dabhade, Maharashtra 410507, India",917058501240,Maharashtra,Pune,
GK looks,"Anubhavi Medicos Shop No 30, Gaur Siddhartham High Street Market, Pratap Vihar, Ghaziabad, Uttar Pradesh 201009, India",918087772222,Uttar Pradesh,Noida,
GK Saloon n Spa,"JV87+9GF, near by kapoor garments, Katra Karam Singh, Amritsar, Amritsar Cantt., Punjab 143006, India",918054977479,Punjab,Amritsar,
glam & grace beauty salon,"182, Ardali Bazar Rd, Orderly Bazar, Varanasi, Uttar Pradesh 221102, India",918052558403,Uttar Pradesh,Varanasi,
Glam 11 salon,"288/6 Madhav bhawan, Arya Nagar, Charbagh, Lucknow, Uttar Pradesh 226004, India",917007722764,Uttar Pradesh,Lucknow,
Glam box,"MVQR+6PP, Channi Himat, Jammu, 180015",917051342092,Jammu & Kashmir,Jammu,
glam bp,"22/483, Hirasingh Bagan, Sakchi, Jamshedpur, Jharkhand 831001, India",919193048880,Jharkhand,Jamshedpur,
Glam Gaze salon,Unknown,917355739215,Uttar Pradesh,Kanpur,
glam impression salon,"6/14, Block 6, East Patel Nagar, Patel Nagar, New Delhi, Delhi 110008, India",919811750816,Uttar Pradesh,Noida,
Glam Look,"QR4V+C42, near Bonn Bread Factory, Panduka, Colony, Paloura, Jammu, 181121",917889853169,Jammu & Kashmir,Jammu,
glam touch,"R545+X3J, Padma Rd, Bhatia Colony, Kadma, Jamshedpur, Jharkhand 831005, India",918092302586,Jharkhand,Jamshedpur,
Glam up Beauty Parlour,"1/1, Sports Colony, Victoria Park, opp. Professors Colony, Mangal Pandey Nagar, Ramgarhi, Meerut, Uttar Pradesh 250001, India",917017381175,Uttar Pradesh,Meerut,
Glam up makeover,"P62H+HX6, Billanwali Chhapary, Pratap Colony, Khanna, Punjab 141401, India",919914218444,Punjab,Ludhiana,
Glam Up Salon & Makeup studio,"JVCC+V74, Savitribai Phule Rd, Krishna Nagar, Gokul Colony, Dighi, Pune, Pimpri-Chinchwad, Maharashtra 411015, India",917887567944,Maharashtra,Pune,
Glamorise unisex salon,"FVH8+538, Biju Patnaik Colony, Cuttack, Odisha 753008, India",917873894252,Odisha,Cuttack,
glamorous beauty parlour,"B-51, Jwala Singh Wala Rd, Dal Singh Nagar, Hanumangarh, 49 Ngc, Rajasthan 335512, India",918104580686,Rajasthan,Hanumangarh,
Glamorous Beauty salon,"34, Haines Rd, Pulikeshi Nagar, Frazer Town, Bengaluru, Karnataka 560005, India",917204796792,Karnataka,Bengaluru,
glamour,"24/86, Mau Rd, Syndicate Bank Colony, Khandar, Agra, Uttar Pradesh 282007, India",917088359436,Uttar Pradesh,Agra,
Glamour Beauty Salon,"Wadmukhwadi, Alankapuram, Charholi Budruk, Maharashtra 412105, India",919146043333,Maharashtra,Pune,
Glamour Beauty Zone,"Shop No, 1, Sultanwind Rd, Chungiwala Bazar, Gobind Nagar, Amritsar Cantt., Amritsar, Punjab 143001, India",918054220330,Punjab,Amritsar,
Glamour Emporium,"34-A, Puda Colony, Green Avenue, Amritsar, Punjab 143001, India",917973042362,Punjab,Amritsar,
Glamour emporium salon,"391, Puda Colony, Green Avenue, Amritsar, Punjab 143001, India",917986555617,Punjab,Amritsar,
Glamour Hair & Beauty Salon,"Chiroli, Shop No 1, Alankapuram society, Alankapuram, Charholi Budruk, Maharashtra 412105, India",919326223994,Maharashtra,Pune,
Glamour Makeover & Academy,"987, Rao Colony, Tukaram Nagar, Talegaon Dabhade, Maharashtra 410506, India",919172821209,Maharashtra,Pune,
glamour unisex salon,"Nawka House, Krishna Prasad Rd, near JSB Udayaan, Dibrugarh, Assam 786001, India",916000340726,Assam,Dibrugarh,
glamour World,"Q5P8+8W8, Rd Number 7, Aditypur 1, Aditypur Colony Site No 1, Adityapur, Jamshedpur, Jharkhand 831013, India",919570171947,Jharkhand,Jamshedpur,
Glamour zone Beauty and hair spa,"Z-8, Shastri Nagar, Izatnagar, Bareilly, Uttar Pradesh 243003, India",919897597923,Uttar Pradesh,Bareilly,
Glamour Zone Beauty salon,"8J7W+X4H, Babu Jagjivan Ram Cir, Devaraja Mohalla, Yadavagiri, Mysuru, Karnataka 570001, India",919663961325,Uttar Pradesh,Biolume Ho,
Glamour zone makeover,"P5WV+399, Kamal Vihar, Sant Nagar, Burari, Delhi, 110084, India",918860597636,Delhi,North Delhi,
GLAMRISTHA BEAUTY CLINIC,"PC7V+3W9, Ward 38, Rabindra Sarani, Siliguri, West Bengal 734006, India",918250081137,West Bengal,Siliguri,
glitz,"Silverette Society, plot no 1791 D, St Anthony Rd, near Mathuradas Colony, beside MES Civilian Colony, ???????? ???????, MES ?????, ??????, ????????? ????, ?????, ?????????? 400029, India",917738561353,Maharashtra,Mumbai,
glorious beauty parlour,"Tirupati complex, G.T. ROAD GOBINDPUR, NH 2, Gobindpur, Jharkhand 828109, India",917004232364,Jharkhand,Ranchi,
Glory,"5256+G98 naveen market, Sadar Bazar, Agra Cantt, Idgah Colony, Agra, Uttar Pradesh 282001, India",919368120258,Uttar Pradesh,Agra,
Glossy,"6X9V+849, Ganesh Nagar, Kaushalpura, Agra, Uttar Pradesh 282005, India",918320896070,Uttar Pradesh,Agra,
glossy Beauty parlour,"QFGW+67R, Baheri, Uttar Pradesh 243201, India",919997561381,Uttar Pradesh,Bareilly,
glossy bride,"4HR7+84G, Ganesh Ganj, Mirzapur-cum-Vindhyachal, Mirzapur, Uttar Pradesh 231001, India",917007024911,Uttar Pradesh,Varanasi,
Glossy family salon,Unknown,918248864436,Uttar Pradesh,Bareilly,
Glossy Unisex Salon,"Gorakhpur Rd, Dumari Khurd, Uttar Pradesh 273201, India",919519209293,Uttar Pradesh,Biolume Ho,
gloumr beauty parlour,"C89C+XH5, near Ravi ved, Bassa Para, Sayad Wara, Old Faridabad, Faridabad, Haryana 121002, India",918851717066,Haryana,Faridabad,
gloumr beauty point,"2747, Sector 3, Faridabad, Haryana 121004, India",919871568500,Haryana,Faridabad,
Glow,"67, Shaheed Nagar, Tajganj, Agra, Uttar Pradesh 282001, India",917017902531,Uttar Pradesh,Agra,
Glow & Shine Salon,"220, Kalyanamantapa, Madanayakahalli, Bengaluru, Karnataka 562162, India",919591757892,Uttar Pradesh,Biolume Ho,
Glow and Go,"H278+FPH Vijaypur Park, Amar Market, Vijaypur, 184120",919103105771,Jammu & Kashmir,Jammu,
Glow Beauty parlour,"2XVJ+56C, 2nd St, Janaki Nagar, Sri Laxmi Nagar, Ganapathy, Coimbatore, Tamil Nadu 641006, India",917010882242,Tamil Nadu,Coimbatore,
glow bp,"1565, Kamela Colony Rd, Raghav Puram, Saharanpur, Dara Kottala, Uttar Pradesh 247001, India",918630009285,Uttar Pradesh,Saharanpur,
Glow Care  Beauty Salon,"Mig-72, Phase-1, Model Town, Bathinda, Punjab 151005, India",917888642976,Punjab,Bhatinda,
glow magic hair and beauty salon,"285, 285, Ganganagar Rd, Durga Colony, Hanumangarh, Rajasthan 335512, India",918000619875,Rajasthan,Hanumangarh,
Glow n groom,"WCCR+4MW, Kanchrapara Loco, Jetia, Kanchrapara, West Bengal 743145, India",917439463216,West Bengal,Malda,
glow studio,"R6R3+CWW, Purulia Rd, Iqra Colony, Mango, Jamshedpur, Jharkhand 832110, India",919546307243,Jharkhand,Jamshedpur,
glowing glory,"4/4, near Post Office, Block G, Indira Enclave, Sector 21D, Faridabad, Haryana 121002, India",919711414644,Haryana,Faridabad,
Gold feuer salon,"Galleria Market Crossing Repulik, Gzb, JCGP+C5C, Crossings Republik, Ghaziabad, Uttar Pradesh 201016, India",919953508503,Uttar Pradesh,Noida,
Goldan Glow Bp,"FQQW+W44, Urit Nagar, Warje, Pune, Maharashtra 411058, India",919767238478,Maharashtra,Pune,
Goldan Glow Bp l,"36/1/84, Wanrai Colony, Khanapur Village, Pune, Maharashtra 411046, India",919767238479,Maharashtra,Pune,
Golden fader,"44G9+RFM, Dalip Nagar, Nawanshahr, Punjab 144514, India",918285055551,Punjab,Jalandhar,
Golden Father Family Salon,"MSR College Bus Stop , 1066 , Kings House, Triveni Main Rd, Gokula 1st Stage, Divanarapalya, Mathikere, Bengaluru, Karnataka 560054, India",919880522563,Uttar Pradesh,Biolume Ho,
Golden glow  VYTTILA,"eroor, Vyttila, Kochi, Ernakulam, Kerala 682019, India",919846567127,Kerala,Cochin,
golden scissor,"728, BRS Nagar Main Rd, Block I, Bhai Randhir Singh Nagar, Ludhiana, Punjab 141012, India",918528098678,Uttar Pradesh,Biolume Ho,
golden scissor salon,"14 D, State Highway 25, Sahibzada Jujhar Singh Avenue, Guru Amardas Avenue, Gumtala Sub Urban, Guru Amardas Avenue, Amritsar, Punjab 143101, India",918427491814,Punjab,Amritsar,
Golden scissors,"728, BRS Nagar Main Rd, Block I, Bhai Randhir Singh Nagar, Ludhiana, Punjab 141012, India",918528098678,Punjab,Ludhiana,
Golden Touch Beauty Salon,"Rutej Park Apartment, Sector 32A, Plot No. SDC-3, Ravet Pune, Rajyog Colony Rd, Shivala Colony, Sector 32 A, Nigdi, Pimpri-Chinchwad, Maharashtra 411033, India",919890288588,Maharashtra,Pune,
good look,"Plot No. 233, C-7,Shree Ram Mandir Marg,, Sector 8C, Rohini, Pocket 4, Sector 8C, Rohini, Delhi, 110085, India",919105620296,Delhi,Delhi,
Gorgeous Beauty salon,"277, Avenue Rd, Kumbarpet, Dodpete, Nagarathpete, Bengaluru, Karnataka 560002, India",919113905565,Uttar Pradesh,Biolume Ho,
Gorgeous make-up studio,"3, Hengrabari Rd, Near L.P. School, Lichubagan, Ganeshguri, Guwahati, Assam 781036, India",919954090648,Assam,Guwahati,
gorgeous unisex salon,"98VH+P5P, Sector 14, Faridabad, Haryana 121006, India",919871650904,Haryana,Faridabad,
gossip salon,"C-115, Street No 8, Gumtala Sub Urban, Guru Amardas Avenue, Amritsar, Punjab 143001, India",919876577303,Punjab,Amritsar,
gourish beauty parlour,"300-7E, Huda Market, Sector 7a, Block E, Sector-07, Faridabad, Haryana 121006, India",918178266784,Haryana,Faridabad,
gp makeover,"PMRP+4JF, Jaycees Crossing, Husainabad, Jaunpur, Uttar Pradesh 222002, India",919540959501,Uttar Pradesh,Varanasi,
grace beauty parlour,"Bank Colony Rd, Hanumangarh, Rajasthan 335513, India",918949112140,Rajasthan,Hanumangarh,
Grace beauty spa,"Vinayaka Complex, 2331, Trichy Rd, Ondipudur, Coimbatore, Tamil Nadu 641016, India",919940799541,Tamil Nadu,Coimbatore,
Grace Beauty Zone & Training Center,"XMG5+66Q, Bhola Rd, Shiv Kunj Colony, Yadav Colony, Meerut, Uttar Pradesh 250002, India",918218948198,Uttar Pradesh,Meerut,
Grace N Blonde Unisex Salon,"134B, Block C, Sector 61, Noida, Uttar Pradesh 201301, India",917509276305,Delhi,Delhi,
Grace of God salon,"T8, Bindapur Matiala Rd, Param Puri, Uttam Nagar, New Delhi, Delhi, 110059, India",918076129719,Uttar Pradesh,Noida,
GRACE SALON,"2CV5+2XV, Civil Lines, Gurdaspur, Shehzada Nangal, Punjab 143521, India",917837449797,Punjab,Amritsar,
Graduate salon,"85, A - Block Market Main Rd, Gumtala Sub Urban, A - Block, Ranjit Avenue, Amritsar, Punjab 143001, India",919877031723,Punjab,Amritsar,
Grandeour unisex salon,"68, Garh Rd, behind Hotel Harmony Inn, Janta Nagar, Ramgarhi, Meerut, Uttar Pradesh 250002, India",910800636502,Uttar Pradesh,Meerut,
greac bp,"XGJX+X99, Muncipal Colony, Saharanpur, Uttar Pradesh 247001, India",919457823024,Uttar Pradesh,Saharanpur,
greatful Heads family salon,"Venkatesha Nilayam, EWS-591, Phase 1, Kukatpally Housing Board Colony, Kukatpally, Hyderabad, Telangana 500085, India",919052250708,Telangana,Hyderabad,
Greek Beauty Salon,"60ft Road, Sidhu complex, 100 Feet Rd, beside Dr Maheshwari, Batinda, Bathinda, Punjab 151001, India",919855403500,Punjab,Bhatinda,
green planet beauty,"46, 46, Adarsh Nagar Rd, P Block, Sri Ganganagar, 6 Z, Rajasthan 335001, India",919887106891,Rajasthan,Hanumangarh,
Green way unisex salon,"4/107, Palladam Main Rd, Karuppa Gaundanpalayam, Tiruppur, Tamil Nadu 641605, India",919787235566,Tamil Nadu,Coimbatore,
gress beauty parlour v,"Shop no. 1, Ganesh Nandanvan, Dalavi Nagar, Ambegaon Budruk, Pune, Maharashtra 411046, India",918149144464,Maharashtra,Pune,
Grooming Hair Salon,"72, Patoli, Sector 1, Paloura, Jammu, 181121",917006477873,Jammu & Kashmir,Jammu,
Gungun's Beauty Salon & Academy,"Shitole Empire,Shop No.15, In line of Mahanagar Bank, near Mahanagar Bank, Ganesh Nagar, Sant Tukaram Nagar, New Sangavi, Pimpri-Chinchwad, Maharashtra 411027, India",919922554267,Maharashtra,Pune,
Gunjan Beauty Salon,"shop no.7, 9, Sadar Bazar, Tapa, Tappa R, Punjab 148108, India",919876383328,Punjab,Bhatinda,
gurgaon unisex salon,"F3G7+Q6H, Sukhrali Rd, near kalajeet tower, Sukhrali, Sector 17, Gurugram, Haryana 122001, India",919310930219,Haryana,Gurugram,
Gurnoor mokeover,"Durga Mandir Lane, Main Market - Galla Mandi Rd, Rudrapur, Uttarakhand 263153, India",917355666677,Uttar Pradesh,Moradabad,
Guru Accademy Salon,"1049, Ganesh Basti Aggarwal Colony, Ganesh Nagar, Bathinda, Punjab 151001, India",919888704703,Punjab,Bhatinda,
Guy s n,"Vaibhav Garden Phase 2, 25/118, Ellora Enclave, DayalBagh, Agra, Uttar Pradesh 282005, India",916985867742,Uttar Pradesh,Agra,
gypsey,"Bhakti Palace, 1, New Link Rd, Kandarpada, Dahisar West, Mumbai, Maharashtra 400068, India",918779624840,Maharashtra,Mumbai,
h f salon,"201-202, Sastri Nagar Rd, Sundervan Complex, Shastri Nagar, Andheri West, Mumbai, Maharashtra 400053, India",918693894691,Maharashtra,Mumbai,
H jawed,"E-146/15, Pani Ki Tanki Rd, Near Water Tank, Shree Ram Market, Ghatwasan, Kamla Nagar, Agra, Uttar Pradesh 282005, India",918660600359,Uttar Pradesh,Agra,
h r 27,"101, Jai Prakash Rd, near Madina Masjid, Yagna Nagar, Versova, Andheri West, Mumbai, Maharashtra 400061, India",919568827743,Maharashtra,Mumbai,
Habbit unisex,"C 15, Gandhi Nagar Rd, Gandhi Nagar, Moradabad, Uttar Pradesh 244001, India",919927542844,Uttar Pradesh,Moradabad,
Habibh Hair & Beauty,"PCNTDA, MR2Q+3VQ, Spine Rd, Culture Crest, Sector No. 6, Moshi, Pimpri-Chinchwad, Maharashtra 412105, India",917038021855,Maharashtra,Pune,
Habibs chandpara,"PCG3+CRX, Kalyani Expy, Madhawpur Village, Dopere, Iswaripur, West Bengal 700118, India",918884183750,West Bengal,Kolkata,
Hair & Blush unisex salon,"195/198, Block C8, Keshav Puram, Tri Nagar, New Delhi, Delhi, 110035, India",918800397838,Delhi,North Delhi,
Hair affair,"1-1A, Cheran Nagar, Koundampalayam, Gounder Mills, Coimbatore, Tamil Nadu 641029, India",919384389021,Tamil Nadu,Coimbatore,
hair and beauty,klyan nagar,917044419006,West Bengal,Kolkata,
hair and beauty family salon,rahara,919290035314,West Bengal,Kolkata,
hair art salon,"3F2Q+8C9, Samaraipur, Bhadrak, Odisha 756100, India",919937526108,Odisha,Bhubaneshwar,
HAIR ARTIST SALON,"Atulya chauradiya City, Kamla Nager Jaipur, Rajasthan India",918690913317,Rajasthan,Jaipur,
hair box,"340, Dr NS Hardikar Rd, Pocket E 20, Pocket 5, Sector 2, Mangolpuri, Delhi, 110085, India",918860855372,Delhi,Delhi,
Hair Buzz Studio,"S.C.O. 35, Sarovar Path, 19D, Sector 19, Chandigarh, 160019, India",919915789909,Punjab,Amritsar,
hair care salon,"935, Sector 20, B Block, Indira Nagar, Lucknow, Uttar Pradesh 226016, India",919450360786,Uttar Pradesh,Lucknow,
hair city,"56, Tehsil Rd, Tura Mandi, Naya Bazar, Masudabad, Najafgarh, Delhi, 110043, India",917982122574,Delhi,Delhi,
Hair Club mens salon,59/17 Graund floor new rohtak road,918750821749,Delhi,North Delhi,
hair craft,"92, Sector 21, Rohini, Delhi, 110086, India",919971514914,Delhi,Delhi,
HAIR EXPERT SALON,"64, New Sanganer Rd, Devi Nagar, Shyam Nagar, Jaipur, Rajasthan 302019, India",916398078221,Rajasthan,Jaipur,
hair express,"28-26, Hanuman Rd, Navpada, Vile Parle East, Vile Parle, Mumbai, Maharashtra 400057, India",917506588256,Maharashtra,Mumbai,
Hair Expression,"9, Hyde Park, Sector 78, Noida, Uttar Pradesh 201305, India",919837909470,Delhi,Delhi,
hair expression unisex salon,"UGF- 12 Hyde Park, Sector 78, Noida, Uttar Pradesh 201305, India",918178113050,Uttar Pradesh,Noida,
Hair Fashion Beauty salon,"01, Turner Rd, Clement Town, Dehradun, Uttarakhand 248002, India",919897118809,Uttarakhand,Dehradun,
Hair freak salon,"14, Peramanur Main Rd, Kamarajar Colony, 4 Roads, Salem, Tamil Nadu 636007, India",919894563645,Tamil Nadu,Coimbatore,
Hair Game salon,"35/7, 35, Block C8, Keshav Puram, Tri Nagar, Delhi, 110035, India",918529882381,Delhi,North Delhi,
Hair Gents Parlour,"Q9J4+9FH Infront of Savitri Complex, Siddharth Nagar Colony, Rajendra Nagar, Gorakhpur, Uttar Pradesh 273001, India",919936578631,Uttar Pradesh,Biolume Ho,
Hair Graduation,"Near Chowadi Chowk, NATIONAL HIGHWAY, BYE PASS, Sector-C, Sainik Colony, Jammu, 180015",919779955669,Jammu & Kashmir,Jammu,
