Shop Name,Address,Contact,State,City,GST
raunak bp,"HFX5+4R4, Moubhandar, Ghatshila, Jharkhand 832103, India",919931307528,Jharkhand,Jamshedpur,
ravsing beauty parlour,"Shop no. 1, New, IDH Market, Near Bus Stand, Kot Atma Singh, Amritsar, Punjab 143001, India",919988969466,Punjab,Amritsar,
Raza salon,"RWXV+7WG, Mahatma Gandhi Marg, Near New Market, Hazratganj, Lucknow, Uttar Pradesh 226001, India",917007716660,Uttar Pradesh,Lucknow,
rbv 's unisex salon,"club house, mahagun mezzaria, Sector 78, Noida, Uttar Pradesh 201304, India",919999141110,Uttar Pradesh,Noida,
rbv unisex salon,"COMMERCIAL BLOCK, MAHAGUN MODERNE, Mantova St, Mahagun Moderne, Sector 78, Noida, Uttar Pradesh 201305, India",919818738218,Uttar Pradesh,Noida,
RD brother,"VX82+2W5, Ward No.12, Kathiala, Fatehgarh Churian, Punjab 143602, India",918528072959,Punjab,Amritsar,
rds salon,"RQV9+7GQ, Civil Lines, Moradabad, Uttar Pradesh 244001, India",918938053141,Uttar Pradesh,Moradabad,
real look Beauty salon,"F3PG+8VC, Ward No. 16, Pilibanga, Rajasthan 335803, India",918264390021,Rajasthan,Hanumangarh,
real women,harmu ,917004312939,Jharkhand,Ranchi,
REBA UNISEX,"Plot no. 1B/11 CDA Sector-10, CDA Sec - 10, Cuttack, Odisha 753014, India",919040041084,Odisha,Cuttack,
Rebal salon,"5X95+PJF, Jawali, Bhermar Khas, Himachal Pradesh 176021, India",917018293097,Punjab,Amritsar,
Red Rose unisex salon,"A-17, Block B, Acharya Niketan, Mayur Vihar, Delhi, 110091, India",919990140582,Delhi,Delhi,
red shine,"Mear Masjid, Shop No-69, Peoli Nagar Path, Peoli Nagar, Moranhat Town, Mirihula Block, Assam 785670, India",918822719688,Assam,Dibrugarh,
reddinent parlour,"189, Krishna Nagar Colony, Krishna Nagar, Alambagh, Lucknow, Uttar Pradesh 226023, India",918299721949,Uttar Pradesh,Lucknow,
redical beauty Surat,"37, Shri TN Kundra Marg, Block G, Kamla Nagar, Delhi, 110007, India",919978841890,Uttar Pradesh,Noida,
Redrose beauty parlour,"9V5V+F9X, Bhubaneswar, Odisha 754001, India",917978918794,Odisha,Cuttack,
Reds Matrix salon,"R2R8+H75, Khargapur Rd, Geeta Puri, Khargapur, Gomti Nagar, Lucknow, Uttar Pradesh 226010, India",917985735105,Uttar Pradesh,Lucknow,
Reds professional salon,"406, Anand Tower Ln, Moti Vihar Society, Sarvodaya Nagar, Kanpur, Uttar Pradesh 208005, India",919335683214,Uttar Pradesh,Kanpur,
reeny salon,Mulund,919819761063,Maharashtra,Mumbai,
reetu chawla,"Shop No.1C-1/12, Vishwakarma Setu, Bata B Colony, New Industrial Twp 1, New Industrial Township, Faridabad, Haryana 121001, India",919210451392,Haryana,Faridabad,
reeva parlour,"141, Sector 12, Vrindavan Colony, Lucknow, Baraulikhalilabad, Uttar Pradesh 226029, India",917897124513,Uttar Pradesh,Lucknow,
reflection,"97VQ+GRJ, New Industrial Township 2b, Block F, New Industrial Twp 3, New Industrial Township, Faridabad, Haryana 121012, India",918368895475,Haryana,Faridabad,
reflection makeover,"279, Sector 7a, Block A, Sector 7, Faridabad, Haryana 121006, India",918920650537,Haryana,Faridabad,
Reflection Unisex,"Meghalaya Urban Development Agency (MUDA) Building, Quinton Road, Police Bazar, Shillong, Meghalaya 793001, India",917005350186,Meghalaya,Shillong,
Regal salon,"4, Jahangirabad, Bhopal, Madhya Pradesh 462008, India",919981538183,Madhya Pradesh,Bhopal,
Reivive salon pathankot,"9GHC+WR5, College Rd, Urliwand, Kathua, 184101",919803022233,Uttar Pradesh,Biolume Ho,
relax beauty parlour,"R636+68W, Harina Basti, Jharkhand 828306, India",916299893713,Jharkhand,Ranchi,
Relax salon -1,"009, Shiv Puram Phase -I, Kusumkhera, Haldwani, Bomari Tallikham, Uttarakhand 263139, India",918630806450,Uttar Pradesh,Moradabad,
Relax zone,"S7/1598, Jatta Wala Bazaar Rd, Gilwali Gate, Jauranpipal Bazar Area, Amritsar, Amritsar Cantt., Punjab 143006, India",917837815477,Punjab,Amritsar,
reliance beauty salon,"S 9/91-G, Pandeypur, Pandeypur Chauraha, Naibasti, Varanasi, Uttar Pradesh 221002, India",919307251437,Uttar Pradesh,Varanasi,
Relife Unisex Salon,"JPFJ+GCW, Gaikwad Nagar Rd, Punawale, Pimpri-Chinchwad, Maharashtra 411033, India",917743927529,Maharashtra,Pune,
Relook,"A37, Murli Bagh, Sarla Bagh, DayalBagh, Agra, Uttar Pradesh 282005, India",918077268521,Uttar Pradesh,Agra,
rema makeover,"88JC+WV6, Garg Colony, Ballabhgarh, Faridabad, Haryana 121004, India",919711677541,Haryana,Faridabad,
"Renew unisex salon, Edapally","V9C9+F28, Kannur, Kerala 670001, India",918129246136,Kerala,Cochin,
Renz Makeover,"Kabir Colony Talab Tillo, Ambica Vihar Coloney, Jammu, 180002",918493893970,Jammu & Kashmir,Jammu,
Reshma Makeover,"1, Old Survey Rd, Karanpur, Dehradun, Uttarakhand 248001, India",917055517280,Uttarakhand,Dehradun,
reva,"38, near Gurdwara Sri Guru Nanak Nagar, J B Nagar, Andheri East, Mumbai, Maharashtra 400059, India",919920782368,Maharashtra,Mumbai,
Revitalize Beauty Parlour,"Mawlai Mawdatbaki, Shillong, Meghalaya 793017, India",918794835750,Meghalaya,Shillong,
Rex sunisex slone,"J-137, DLF, &, 9-10 Dividing Rd, J Block, Sector 10 HBC, Faridabad, Haryana 121006, India",919999519975,Haryana,Faridabad,
Rich Look Beauty Salon,"01, More Vasti, Chikhali, Pimpri-Chinchwad, Maharashtra 412114, India",917020883688,Maharashtra,Pune,
riddhi beauty zone & salon,"F3PG+8VC, Ward No. 16, Pilibanga, Rajasthan 335803, India",919929158134,Rajasthan,Hanumangarh,
ridhi Sidhi beauty parlour,"8264+RVV, Harha, Varanasi, Uttar Pradesh 221001, India",916394369701,Uttar Pradesh,Varanasi,
Ridhi'S beauty parlour,"01, Jambawati Path, Lichubagan, Hengrabari, Guwahati, Assam 781036, India",918638793261,Assam,Guwahati,
Ridhima salon,"JW45+636, Sultanwind Village, Sultanwind, Amritsar, Amritsar Cantt., Punjab 143006, India",916239332833,Punjab,Amritsar,
Ridhima Sethi beauty salon,"C231, Block C, Surya Nagar, Ghaziabad, Uttar Pradesh 201011, India",918860988484,Uttar Pradesh,Noida,
Ridhis makeover,"C7PX+VH3, Mewala Maharajpur Rd, near CANARA BANK - FARIDABAD SECTOR 46, HBH Colony, Sector 46, Faridabad, Haryana 121001, India",918447103345,Haryana,Faridabad,
rimjhim parlour,"F222+RGH, Lahowal, Niz Lahoal, Assam 786010, India",919395192779,Assam,Dibrugarh,
rimpi Beauty parlour,"5, Dakhingaon Rd, DakhinGaon, Kahilipara, Guwahati, Assam 781019, India",919859464312,Assam,Guwahati,
rinki makeover,"RQPF+C9R, GMD Rd, Budh Bazaar, Moradabad, Uttar Pradesh 244001, India",919760952147,Uttar Pradesh,Moradabad,
rishi hair Villa,nagpur,919922066568,Maharashtra,Nagpur,
RISHI'S HAIR CAFE,"Near Shiv Dhaba & Nathu Cycle Harmada, Jaipur, Rajasthan 302013, India",918107008006,Rajasthan,Jaipur,
Rita beauty spa and salon,"6RRF+5CC, Gopabandhu Nagar, Chhend Colony, Rourkela, Odisha 769015, India",917978760527,Odisha,Cuttack,
Ritas salon,"H9W3+44C, Strand Bank Rd, Ahiritola, Beniatola, Kolkata, West Bengal 700005, India",919830793522,West Bengal,Kolkata,
ritaz bp,"21/1/2, Dhanwanti Niwas, Rd Number 5, Bagbera Colony, Jugsalai, Jamshedpur, Bagbera colony, Jharkhand 831002, India",919172503643,Jharkhand,Jamshedpur,
Rithiksas bridal studio,"Meenakshi nagar 1st Street, Gandhi Nagar Main Rd, Marudiah Nagar, Gandhi Nagar, Ganapathy, Coimbatore, Tamil Nadu 641006, India",919843050055,Tamil Nadu,Coimbatore,
Ritika beauty salon,"119, Rani Bagh Rd, Kailash Enclave, Shakti Vihar, Pitampura, Delhi, 110034, India",919717593673,Delhi,North Delhi,
ritika make over,"WRC8+8CM, Haibowal Main Rd, near UCO Bank - Haibowal Kalan, Durga Puri, Haibowal Kalan, Ludhiana, Punjab 141001, India",917986411125,Uttar Pradesh,Biolume Ho,
Ritika's makeover,"3548, Haibowal Main Rd, near Karanvir Diabetes & General Hospital, Durga Puri, Haibowal Kalan, Ludhiana, Punjab 141001, India",917986411125,Punjab,Ludhiana,
ritu makeover,"Shop No 1B-5A, NIT, Near Fawra Singh Chowk, Block B, New Industrial Twp 1, New Industrial Township, Faridabad, Haryana 121001, India",919958623962,Haryana,Faridabad,
ritu makeup studio,"P-19, P Block, Partappura, Shahdara, Delhi, 110032, India",919910908637,Uttar Pradesh,Biolume Ho,
Ritu makeup studio salon,"A- 157, Hanspuram, Naubasta, Kanpur, Uttar Pradesh 208021, India",918707214702,Uttar Pradesh,Kanpur,
Ritz & Glam,"CP 08, 1st Floor, Phoenix United Mall, Kanpur Rd, near Wildcraft, Sector B, Bargawan, LDA Colony, Lucknow, Uttar Pradesh 226012, India",919795125486,Uttar Pradesh,Lucknow,
Riviva salon,"# 24 Green Avenue, Temple Lane, Maqbool Rd, near Krishan Dham Mandir, Green Avenue, Amritsar, Punjab 143001, India",918968972710,Punjab,Amritsar,
Riwaaz beauty salon,"B-I-1164, Bindraban Rd, near Syndicate Complex, Civil Lines, Ludhiana, Punjab 141008, India",919876464387,Punjab,Ludhiana,
Riwaaz makeover,"VX82+2W5, Ward No.12, Kathiala, Fatehgarh Churian, Punjab 143602, India",917814751010,Punjab,Amritsar,
riya's makeup clinic,"129, VHB Shantinagar Colony, Prem Nagar, Nagpur, Maharashtra 440002, India",919423400224,Maharashtra,Nagpur,
Rocks unisex,"GC55+JJM Baniamal, Kendrapara, Odisha 754211, India",918018781271,Odisha,Cuttack,
Rockstyle,"481 , trikut bhawan m.l paliwal, University Rd, Ganapati Nagar, Udaipur, Rajasthan 313001, India",919636388805,Rajasthan,Udaipur,
Roes,"A-19, Parashuram Nagar, Pratap Nagar, Goalpura, Agra, Uttar Pradesh 282010, India",918979863666,Uttar Pradesh,Agra,
Rohini Beauty Parlour,"XQV8+F4V, near Yashlok Hospital, Abdullapur, Meerut, Uttar Pradesh 250001, India",917457027216,Uttar Pradesh,Meerut,
Romeo and juliet,"15-F, Kitchlu Nagar Rd, D-Block, Kitchlu Nagar, Ludhiana, Punjab 141004, India",918528873987,Punjab,Ludhiana,
Ronee beauty parlour,"6, IB St, Jagatpur, Odisha 754021, India",919439637963,Odisha,Cuttack,
roop nikhar salon,h no 42 roshanpura Nagafgrah ,917827391157,Uttar Pradesh,Noida,
Roop shringar beauty parlour,"P7QM+Q55, NCR, Block D, Lal Bagh Colony, Region, Ghaziabad, Uttar Pradesh 201102, India",919873335575,Delhi,New Delhi,
rosa,"36/191, Madiya Katra Rd, Madiya Katra,, Road, Lohamandi, Agra, Uttar Pradesh 282001, India",919359815717,Uttar Pradesh,Agra,
Rose,"Near Old Bus stand, Payyanur, Kerala 670307, India",919744195454,Kerala,Cochin,
rose beauty,"pratap nagar eclass Udaipur, Rajasthan 313002, India",917742577744,Rajasthan,Udaipur,
Rose Beauty parlour,"243201, Nainital Rd, Baheri, Uttar Pradesh 243201, India",918923494108,Uttar Pradesh,Bareilly,
rose buds,"Shop No.-1 & 31, Ground Floor & First Floor, BD Market, BD Block, Block AD, Dakshini Pitampura, Pitampura, Delhi, 110034, India",919582377923,Delhi,Delhi,
Rose marry parlour,"Gulmohar vatica, 1, Sheetla Rd, near Ayushman Hospital & Research Center, Khandari Crossing,Near Bye pass Road, Lawyer's Colony, Agra, Uttar Pradesh 282005, India",919927961514,Uttar Pradesh,Agra,
Rose parlour,"3rd St, Kamakshi Colony, Chrompet,
Chennai - 600047
",919884587122,Tamil Nadu,Chennai,
"Rose, Chalodu","WGH3+Q87, Chalode, Kerala 670595, India",919744265985,Kerala,Cochin,
rosebard,"4, Pitampura Rd, Block BD, Kohat Enclave, Pitampura, Delhi, 110034, India",919811130007,Delhi,Delhi,
"Roses herbal beauty parlor, Kambil","4648+R3W, opposite grand Tejas, Payyanur, Kerala 670307, India",919496641343,Kerala,Cochin,
Roshan Beauty Salon,"Sector C extension sainik colony chowadhi Road, above Axis Bank, Chowadhi, Jammu, 180011",918492088120,Jammu & Kashmir,Jammu,
roshni bp,"MIG-228, Naginapuri, Dindli Basti, Adityapur, Jamshedpur, Jharkhand 831013, India",919142452046,Jharkhand,Jamshedpur,
Rosmarino Salon,"799, Niti Khand I, Indirapuram, Ghaziabad, Uttar Pradesh 201014, India",918920041242,Delhi,Delhi,
Rosy's beauty parlour,"964F+2R9, Tarapur, Odisha 754133, India",917682060574,Odisha,Cuttack,
Rosy's makeover,"62, Mahanadi Vihar - Nayabazar Rd, Mahanadi Vihar, Cuttack, Odisha 753004, India",918249820486,Odisha,Cuttack,
Roxy salon,"9, D-Block, Kitchlu Nagar, Ludhiana, Punjab 141001, India",919877297430,Punjab,Ludhiana,
Roya  Beauty Salon,"Tarsem Chand Manoj Kumar Shop No 74, Grain Market, Ward Number 5, Raman, Punjab 151301, India",919876845173,Punjab,Bhatinda,
Royal Avenue salon,abu plaza abu lane ,919837764402,Uttar Pradesh,Meerut,
royal beauty parlour,"1/4, 1/4, RHB Colony Rd, Housing Board, Hanumangarh, Rajasthan 335512, India",918890235200,Rajasthan,Hanumangarh,
Royal beauty Salon,"JP4H+V8H, Ranbir Singh Pura, 181102",919796454124,Jammu & Kashmir,Jammu,
Royal crown Salon,"17191-B, Gali Number 2, Street No 4, Ekta Colony, Telian Wala Mohalla, Aggarwal Colony, Bathinda, Punjab 151001, India",917814094254,Punjab,Bhatinda,
royal cut,sajirhat,919326325513,West Bengal,Kolkata,
Royal garden,"No.12, Halls Rd, Sector 1, Kilpauk,
Chennai- 600010",919080446635,Tamil Nadu,Chennai,
Royal hair salon,"WVHC+VRV, Subhash Nagar Rd, Near Petrol Pump, Jodhewal Basti, Jodhewal, Ludhiana, Punjab 141007, India",918569000669,Punjab,Ludhiana,
royal look,"215/7, Hirasingh Bagan, Kasidih, Jamshedpur, Jharkhand 831001, India",919199611166,Jharkhand,Jamshedpur,
ROYAL LUXURY UNISEX SALON,"Q98J+VM2, Dabgram Fullbari, Salbari, Panchanai, West Bengal 734009, India",918653661636,West Bengal,Siliguri,
Royal saffron unisex,"Manorajan market complex, Sanamangala Mandir, Kendrapara, Odisha 754211, India",919348838015,Odisha,Cuttack,
"royal touch, jntu","67-15-32/A, Nagamalli Thota, Lalbahadur Nagar, Rajeswari Nagar, Kakinada, Andhra Pradesh 533003, India",918367770111,Uttar Pradesh,Biolume Ho,
Royal villa salon,"Polytechnic Rd, Model Town, Amritsar, Punjab 143105, India",918307754244,Punjab,Amritsar,
"Royal, Ambalapuzha","99M8+7C9, SH 12, Ambalapuzha, Kerala 688561, India",918089480751,Kerala,Cochin,
royale hair experts,"437, Pradeep Bhatia Marg, Pocket 16, Sector 8E, Rohini, Delhi, 110085, India",919958989979,Delhi,Delhi,
Royalty studio salon,"H-6/291, Gali No 6, New Pawan Nagar, Pawan Nagar, Amritsar, Punjab 143001, India",918699967590,Punjab,Amritsar,
RP Looks Unisex Salon,"In the campus & at the gate of Jeevan Marg Sophia Convent School, FQWF+GHR, CC Rd, Ram Naath Nagar, Deoria, Uttar Pradesh 274001, India",917800520256,Uttar Pradesh,Biolume Ho,
RR Studio Salon,"SUPERTECH ECO VILLAGE-1, Panchmukhi mandir, Bisrakh Jalalpur, Greater Noida, Uttar Pradesh 201306, India",917042938686,Delhi,Delhi,
ruaaab,"JVHC+677, Hathi Gate, Katra Ahluwalia, Amritsar, Punjab 143001, India",918565688498,Punjab,Amritsar,
Rubina beauty parlour,"Pushpanjali Market Ground Floor Near Kargil Petrol Pump Sikandra Bodla, 6X33+737, Near Kargil Petrol Pump, Suruchipuram Colony, Sikandra, Agra, Uttar Pradesh 282007, India",916587534568,Uttar Pradesh,Agra,
Ruby nails,"WV67+JM7, Brown Rd, Mohar Singh Nagar, Ludhiana, Punjab 141008, India",917071000094,Punjab,Ludhiana,
Ruby Salon,"11, 11, Banglow Rd, Daudpur, Gorakhpur, Uttar Pradesh 273001, India",918090262127,Uttar Pradesh,Gorakhpur,
ruchi,"B35, Pushpanjali Vihar, Numaish Camp, Saharanpur, Uttar Pradesh 247001, India",918191965555,Uttar Pradesh,Saharanpur,
Ruchika Beauty parlour,"900, Janakpuri, Bareilly, Uttar Pradesh 243003, India",918218006980,Uttar Pradesh,Bareilly,
rufi salon,"53, Noor Mahal Rd, Kali Basti, road, Bhopal, Madhya Pradesh 462001, India",919303087733,Madhya Pradesh,Bhopal,
rup lbp,bashirhat,918906685172,West Bengal,Kolkata,
Rupali beauty,"Shop Number 50 Plot Number Ss2, near Aana Saheb Gardan, Sector 6, Kopar Khairane, Navi Mumbai, Maharashtra 400709, India",919867769375,Maharashtra,Mumbai,
rupam beauty parlour,"Bhairo Mandir Road, F3MG+V5F, opposite parking area, near good luck tailor, Ward No.7, Pilibanga, Rajasthan 335803, India",919694298410,Rajasthan,Hanumangarh,
rupas parlour,"Unnamed Road, Central Namghar, Duliajan Oil Town, Duliajan, Assam 786602, India",917086439603,Assam,Dibrugarh,
Rupashree beauty parlour,"GW57+VHJ, Laxman Pur, Jagatpur, Odisha 754021, India",917749989305,Odisha,Cuttack,
ruumpas make over,barasat,919748725186,West Bengal,Kolkata,
RV professional salon,"Q55R+65R, Kitadih, Jugsalai, Jamshedpur, Bagbera colony, Jharkhand 831002, India",916202316400,Jharkhand,Jamshedpur,
RVB's Salon,"H97Q+G2G, Sector 78, Noida, Uttar Pradesh 201305, India",919891556609,Delhi,Delhi,
S & A Beauty Salon,"C Block Market, Sec 39, Noida",919810367264,Delhi,Delhi,
s b s,"46 Siddhachal Bldg, Office No. 2, Hanuman Rd, next to Cosmos Bank, Satsang CHSL, Navpada, Vile Parle East, Vile Parle, Mumbai, Maharashtra 400057, India",917021417439,Maharashtra,Mumbai,
S BEAUTY ART FAMILY SALON,"Don bosco school road, Ward 41, Don Bosco Colony, Siliguri, West Bengal 734004, India",918617081408,West Bengal,Siliguri,
s lounge salon,"QCP9+942, Bank More, Dhanbad, Jharkhand 826001, India",919234666006,Jharkhand,Ranchi,
S M Family Salon,"1/1, Parnasree Palli, Behala, Kolkata, West Bengal 700060, India",919748462856,West Bengal,Kolkata,
s no white,"M932+CPV, UCIL Complex, Jadugora, Jharkhand 832102, India",918709128528,Jharkhand,Jamshedpur,
s s salon,"VX82+2W5, Ward No.12, Kathiala, Fatehgarh Churian, Punjab 143602, India",919855248969,Punjab,Amritsar,
s studio,"RC4J+67M, Jay Prakash Nagar, Jharudih, Dhanbad, Jharkhand 826001, India",918102947805,Jharkhand,Ranchi,
S.k Beauty Saloon,"H-292, Hall Bazar, Katra Ahluwalia, Amritsar, Punjab 143003, India",917973642212,Punjab,Amritsar,
s&a beauty salons,"Block C Market, C Block, Sector 39, Noida, Uttar Pradesh 201303, India",919810367264,Uttar Pradesh,Noida,
s3n beauty professional family salon,"5Rhh+6R, Narengi Tinali, No.1 Bonda Grant, Guwahati, Assam 781171, India",919394938970,Assam,Guwahati,
S4U beauty lounge,"Cotton Market Complex, 9/B, Palladam Main Rd, beside AMC MULTI SPECIALITY HOSPITAL, Sheriff Colony Extension, Tiruppur, Tamil Nadu 641604, India",919629260073,Tamil Nadu,Coimbatore,
saanvi makeover,"1252/1, Indraprasth Colony, Raghu Vihar, Civil Lines South, Muzaffarnagar, Uttar Pradesh 251001, India",918171356767,Uttar Pradesh,Saharanpur,
Saayuri,"P45, Taj Nagari, Telipara, Tajganj, Agra, Dhandhupura, Uttar Pradesh 282001, India",917983078470,Uttar Pradesh,Agra,
Sadhana signature style studio,"Manik Tala Post Office, Manicktala, Kolkata, West Bengal 700006, India",918777412305,West Bengal,Malda,
Sagun Beauty parlour,"2227+4HR, Punjabi Colony, Ujhani, Uttar Pradesh 243639, India",918630445440,Uttar Pradesh,Bareilly,
saheli beauty parlour,"H8JG+88P, Hanumangarh, Rajasthan 335513, India",919982810600,Rajasthan,Hanumangarh,
Saheli beauty salon,"MC6F+WFQ, 13, Sukantapally, Shibachal, Birati, North Dumdum, West Bengal 700051, India",918981556485,West Bengal,Kolkata,
Sahib Saloon,"S5/1093, Shakti Nagar, Amritsar, Amritsar Cantt., Punjab 143001, India",918146167886,Punjab,Amritsar,
Sahil Hair Story,"13-B, Gandhi Gram Dakra, Garhi Cantt, Dehradun, Uttarakhand 248003, India",918958966495,Uttarakhand,Dehradun,
SAHIL'S FASHION SALLON,"Kanta Chorha, Shop No. B1,B2, Shree Mangalam Tower, Laxmi Nagar III, Jagannath Puri, Suraj Nagar, Jhotwara, Jaipur, Rajasthan 302012, India",919799201972,Rajasthan,Jaipur,
Sahina Top Cut Unisex Salon,"Market Bulding, Sector 11, Panchkula, Haryana 134117, India",910988841705,Chandigarh,Chandigarh Tri City,
Sai Beauty Makeovers,"sallain Talab Udhampur,near metador stand",919622012030,Jammu & Kashmir,Jammu,
sai krishna makeover,"LB-36, BRIT Colony, Jharapada, Bhubaneswar, Odisha 751006, India",918249095855,Odisha,Bhubaneshwar,
Sai krupa beauty parlour,"FW75+4HQ, Gandarpur, Cuttack, Odisha 753004, India",917735965336,Odisha,Cuttack,
Sai Sakhi beauty parlour,"GW67+5R5, IB St, Laxman Pur, Jagatpur, Odisha 754021, India",919337155787,Odisha,Cuttack,
Sai sidhi beauty salon and spa,"GW25+PR8, Pandasahi Rd, Jagatpur, Odisha 754021, India",917011603210,Odisha,Cuttack,
Saima Beauty Clinic,"233, GH-9 Block, Paschim Vihar, New Delhi, Delhi, 110087, India",919811166898,Delhi,Delhi,
SAIN'S SCISSORS,"G-3, Galaxy Star, 1st Floor, Opp. National Handloom, Vidhyadhar Nagar, Jaipur, Rajasthan 302016, India",919950509907,Rajasthan,Jaipur,
saira makeup studio and salon,"Street No. 9, New Shiv Puri Rd, Master Colony, New Shiv Puri, Ludhiana, Punjab 141001, India",919872811199,Punjab,Ludhiana,
SAJ SINGHAR BEAUTY SALON,"PC2G+H4P, GOUSALA ROAD, Ward 26, Babupara, Siliguri, West Bengal 734005, India",919832471032,West Bengal,Siliguri,
"Sajisha, Kanhangadu","83CP+QQ6, Puthiyavalapu, Kanhangad, Kerala 671531, India",919846503492,Kerala,Cochin,
sajun beauty clinic,"5R25+H9Q, Milan Nagar, Borbari, Guwahati, Assam 781036, India",919707645569,Assam,Guwahati,
Sakir man salon,"1928, Pocket A, Block A, GTB Enclave, Dilshad Garden, Delhi, 110093, India",918130046854,Delhi,Delhi,
Sakshi beauty parlour,"388/C, Kailash Nagar, Jajmau Sub Metro City, Kanpur, Uttar Pradesh 208010, India",919335680742,Uttar Pradesh,Kanpur,
salim hair salon,"H8GH+JG6, Railway Station Rd, Prem Nagar, Hanumangarh, Rajasthan 335513, India",918947871820,Rajasthan,Hanumangarh,
salon Beauty parlour,"9C36+35H, Ayub Khan - Choupla Rd, Kishore Bazar, Civil Lines, Bareilly, Uttar Pradesh 243001, India",919837694975,Uttar Pradesh,Bareilly,
Salon expert,"Bibiwala Apartments, Dawood Baug Rd, Dawood Baug, Fish Market Area, Navneeth Colony, Andheri West, Mumbai, Maharashtra 400058, India",918097964758,Maharashtra,Mumbai,
Salon H n S,"Plot No GH 06 Fresco Chowk, Sector 137, Noida, Kulesara, Uttar Pradesh 201305, India",919999061656,Delhi,Delhi,
Salon manthra Magnum,"19, Rajaji Rd, Hasthampatti, Salem, Tamil Nadu 636007, India",919677144218,Tamil Nadu,Coimbatore,
sam & jas salon,"3/56, Vinamra Khand, Gomti Nagar, Lucknow, Uttar Pradesh 226010, India",918009580450,Uttar Pradesh,Lucknow,
Sam unisex salon,"5256+38Q, Sadar Bazar, Agra Cantt, Idgah Colony, Agra, Uttar Pradesh 282001, India",917983712692,Uttar Pradesh,Agra,
samaisha unisex salon,"J28H+J55, Main Kakrola Rd, Patel Garden, Block A, Sector 15 Dwarka, Kakrola, Delhi, 110078, India",919289031662,Uttar Pradesh,Noida,
Sameera,"1/B, Andheri Co-Operative Housing Society Rd, near Fidai Baug, Lohana Colony, Andheri West, Mumbai, Maharashtra 400058, India",919326473982,Maharashtra,Mumbai,
Sample Cosmetics,"418, GP Block, Sector V, Saltlake, Kolkata, West Bengal 700091, India",918956235689,Uttar Pradesh,Corporate Head Office,
Sample Distributor,"TOWER-1, INFINITY THINK TANK, GP Block, Sector V, Bidhannagar, Kolkata, West Bengal 700091, India",919007900750,Uttar Pradesh,Corporate Head Office,
SAMPURNA LADIES SALON,"J/181, Block J, Baishnabghata Patuli Twp, Patuli, Kolkata, West Bengal 700094, India",919830340833,West Bengal,Kolkata,
Samreen bp,"R6V7+67G, Rd Number 15, Palm Tree Society, Jharkhand Colony, Mango, Jamshedpur, Jharkhand 831012, India",918434571972,Jharkhand,Jamshedpur,
San Beauty parlour,"2nd cross, 1st main, shivakumarswamy road, Madanayakahalli, Bengaluru, Karnataka 562162, India",919880398104,Uttar Pradesh,Biolume Ho,
Sana Beauty salon,"19/2, Dinnur Main Rd, Ex Servicemen Colony, Dinnur, RT Nagar, Bengaluru, Karnataka 560032, India",916366106951,Karnataka,Bengaluru,
Sandhira's Beauty Sal,"168, Sector 37 C, Sector 37, Chandigarh, 160036, India",919815550324,Chandigarh,Chandigarh Tri City,
Sandhya beauty parlour,"House No H/12, Ground Floor Holding No 865, Ward No 32, Gopabandhu Nagar, Chhend Colony, Rourkela, Odisha 769015, India",918599882507,Odisha,Cuttack,
Sandy's beauty parlour,"CV2V+4CC, Urali, Odisha 753011, India",919337776259,Odisha,Cuttack,
Sangam unisex salon,"Tis Hazari, DDA Building, Sham Nath Marg, Railway Colony, Civil Lines, Delhi, 110054, India",919999818014,Delhi,North Delhi,
Sangeeta,"P44, Taj Nagari, Telipara, Tajganj, Agra, Dhandhupura, Uttar Pradesh 282001, India",918865998322,Uttar Pradesh,Agra,
Sangeeta beauty salon,"7XF9+C25, Chitaipur - Chunar Rd, Indira Nagar Colony, Bhullanpur, Varanasi, Uttar Pradesh 221004, India",919044140901,Uttar Pradesh,Varanasi,
sanjana,"Om Complex, G-1/33, Sikandra-Bodla Rd, Radha Nagar, Sikandra, Agra, Uttar Pradesh 282007, India",918958633573,Uttar Pradesh,Agra,
Sanjit hair Salon,"QR5W+PRV, Janipur, Jammu, 180007",919682300448,Jammu & Kashmir,Jammu,
sanjivani bp,"1, Rd Number 15, Adityapur 2, Bikrampur, Adityapur, Jamshedpur, Jharkhand 831013, India",918409947136,Jharkhand,Jamshedpur,
sansar beauty parlour,"CRJG+39F, Badagaon, Baragaon, Uttar Pradesh 221204, India",917355214386,Uttar Pradesh,Varanasi,
Sanskrit Makeup Studio,"44, Cantonment Rd, Murli Nagar, Husainganj, Lucknow, Uttar Pradesh 226018, India",917985462904,Uttar Pradesh,Lucknow,
SANTANUS CREATION FAMILY SALON,"1/6, Netaji Subhash Chandra Bose Rd, near DEBAM COSMETICS, Ashok Nagar Colony, Shantigarh, Tollygunge, Kolkata, West Bengal 700040, India",917439914836,West Bengal,Kolkata,
Santosh Beauty Parlour,"2PVG+VF7, Bir, Himachal Pradesh 176077, India",918580751239,Punjab,Amritsar,
Santoshi beauty parlour,"TRISHULIA BAZAR, near ANDHRA BANK, Kusinda, Odisha 754005, India",919861080168,Odisha,Cuttack,
sanvi bp,"GRF6+Q2X, Bypass Road, Gitilpi, Jharkhand 833201, India",917368978232,Jharkhand,Jamshedpur,
saoln,"B 504/5 Sangam Palace, Kaveri Kunj, Kamla Nagar, Agra, Uttar Pradesh 282004, India",918791836558,Uttar Pradesh,Agra,
Sapana Beauty parlour,"80/11, Ayush Garden, Sector 16, Chikhali, Pimpri-Chinchwad, Maharashtra 411019, India",917387995199,Maharashtra,Pune,
sapna makeover,"2341, NH-19, Sector 31, Faridabad, Haryana 121008, India",919210385807,Haryana,Faridabad,
sapphire beauty salon,"25b, Raja Raj Ballav St, Sovabazar, Baghbazar, Kolkata, West Bengal 700003, India",919163827704,West Bengal,Malda,
Sara's Makeover,"Bhavani Complex, 6, CDA Sec - 10, Cuttack, Odisha 753014, India",918926064192,Odisha,Cuttack,
Sarah's Unisex Salon,"Lower Ground, 09 Galleria, Greater Noida W Rd, Gaur City 2, Greater Noida, Ghaziabad, Uttar Pradesh 201009",919205635497,Delhi,Delhi,
Sarala beauty parlour,"C84W+G5H, Korua - Mahala Jagannath Temple Rd, Korua, Odisha 754153, India",919853762661,Odisha,Cuttack,
Saraswati Salon,"W4CH+4X4, Tallab Salian, Lambi Gali, Udhampur, 182101",919906354060,Jammu & Kashmir,Jammu,
sarika bp,"33, Mission Compound, Saharanpur, Uttar Pradesh 247001, India",919045591932,Uttar Pradesh,Saharanpur,
sarita,"39/2, Mohna Rd, Yadav Colony, Ballabhgarh, Faridabad, Haryana 121004, India",919582337709,Haryana,Faridabad,
